,anime_id,title,title_english,genre
5188,8218,Fushigi na Elevator,The Elevator,Fantasy
5189,8220,Baby Felix,Baby Felix,"Comedy, Kids"
5190,8226,Akuma-kun (Movie),,"Adventure, Horror, Supernatural, Magic, Fantasy"
5191,8227,Akuma-kun: Youkoso Akuma Land e!!,,"Adventure, Fantasy, Horror, Magic, Supernatural"
5192,8228,Jigoku Sensei Nube: Gozen 0 toki Nube Shisu!,Hell Teacher Nube: 0 a.m. Nube Dead,"Adventure, Comedy, Horror, Supernatural, School, Shounen"
5193,8230,True Tears Epilogue,,"Romance, Music, Drama"
5194,8231,Princess Lover!: Magical Knight Maria-chan,,"Magic, Parody"
5195,8233,Genji,,"Historical, Magic, Romance"
5196,8234,Muumin,,"Adventure, Comedy, Fantasy, Slice of Life"
5197,8235,Muumin (1972),,"Adventure, Comedy, Fantasy, Slice of Life"
5198,8239,Anime Yasei no Sakebi,Call of the wild,"Adventure, Drama"
5199,8240,Wanpaku Oomukashi Kum Kum,Kum Kum,"Kids, Adventure, Comedy, Historical"
5200,8241,Rio: Rainbow Gate!,Rio - Rainbow Gate!: Reshuffle,"Game, Comedy, Ecchi"
5201,8245,Metal Fight Beyblade vs. Taiyou: Shakunetsu no Shinryakusha Sol Blaze,,"Adventure, Comedy, Sports"
5202,8246,Naruto: Shippuuden Movie 4 - The Lost Tower,,"Action, Comedy, Martial Arts, Shounen, Super Power"
5203,8247,Bleach Movie 4: Jigoku-hen,Bleach the Movie: Hell Verse,"Action, Comedy, Super Power, Supernatural, Shounen"
5204,8248,Soukou Kihei Votoms: Case; Irvine,Armored Trooper Votoms: Case; Irvine,"Action, Drama, Mecha, Military, Sci-Fi"
5205,8249,Votoms Finder,Votoms Finder Armored Trooperoid,"Action, Drama, Mecha, Military, Sci-Fi"
5206,8250,Soukou Kihei Votoms: Koei Futatabi,Armored Trooper Votoms: Alone Again,"Action, Drama, Mecha, Military, Sci-Fi"
5207,8275,Kanin Tokkyuu Michishio,,Hentai
5208,8277,Hyakka Ryouran: Samurai Girls,Samurai Girls,"Action, Comedy, Ecchi, Harem, Samurai, School"
5209,8278,Biohazard 4: Incubate,,"Action, Demons, Horror, Military, Mystery, Police, Supernatural, Thriller"
5210,8285,Ai no Senshi Rainbowman,,"Action, Adventure, Mecha, Sci-Fi"
5211,8287,SD Gundam Sangokuden Brave Battle Warriors,,"Action, Mecha, Historical"
5212,8289,Toumei Ningen R,,Hentai
5213,8290,Inmu Gakuen: Inmu ni Torawareta Bijin Shimai,,Hentai
5214,8291,Ojousama wa H ga Osuki: The Animation,,Hentai
5215,8292,Seitokaichou Hikaru,,Hentai
5216,8293,Gakuen Saimin Reido,,Hentai
5217,8294,Shinshou Genmukan,,Hentai
5218,8297,Planzet,Planzet,"Action, Mecha, Sci-Fi"
5219,8302,Ladies versus Butlers! Specials,,"Ecchi, Seinen"
5220,8304,Koutetsu Sangokushi Special,,"Historical, Shounen"
5221,8310,Magic Kaito,,"Adventure, Comedy, Romance, Shounen"
5222,8311,Tegamibachi Reverse,Tegami Bachi: Letter Bee Reverse,"Adventure, Supernatural, Fantasy, Shounen"
5223,8312,Piece,,Music
5224,8314,Tentai Senshi Sunred: Short Corner,,"Comedy, Parody, Seinen, Super Power"
5225,8316,Kawasaki Frontale x Tentai Senshi Sunred,,"Comedy, Parody, Seinen, Sports, Super Power"
5226,8317,Sayonara Zetsubou Sensei Jo: Zoku Zetsubou Shoujo Senshuu,,"Comedy, Parody, School"
5227,8324,Pelican Road Club Caroucha,,"Drama, Romance, Shounen"
5228,8331,Detective Conan Magic File 4: Osaka Okonomiyaki Odyssey,,"Police, Comedy, Mystery, Shounen"
5229,8332,Kudan,,Fantasy
5230,8333,Kodomo no Keijijougaku,A Child&#039;s Metaphysics,Fantasy
5231,8336,Hanakappa,,"Comedy, Kids"
5232,8337,Shoka,,"Action, Fantasy, Historical"
5233,8339,Kachou no Koi,,"Comedy, Romance, Yaoi"
5234,8348,Tengen Toppa Gurren Lagann: Parallel Works 2,,"Mecha, Music"
5235,8353,Ketsuinu,,Comedy
5236,8358,Crayon Shin-chan Movie 01: Action Kamen vs. Haigure Maou,,"Action, Adventure, Comedy, Seinen"
5237,8359,Crayon Shin-chan Movie 04: Henderland no Daibouken,,"Slice of Life, Comedy, Ecchi, School, Seinen"
5238,8360,Crayon Shin-chan Movie 06: Dengeki! Buta no Hizume Daisakusen,,"Slice of Life, Comedy, Ecchi, School, Seinen"
5239,8361,Crayon Shin-chan Movie 07: Bakuhatsu! Onsen Wakuwaku Daikessen,,"Slice of Life, Comedy, Ecchi, School, Seinen"
5240,8362,Crayon Shin-chan Movie 08: Arashi wo Yobu Jungle,,"Action, Adventure, Comedy, Seinen"
5241,8363,Crayon Shin-chan Movie 11: Arashi wo Yobu Eikou no Yakiniku Road,,"Action, Adventure, Comedy, Seinen"
5242,8364,Crayon Shin-chan Movie 12: Arashi wo Yobu! Yuuhi no Kasukabe Boys,,"Action, Adventure, Comedy, Historical, Fantasy, Seinen"
5243,8365,Crayon Shin-chan Movie 13: Densetsu wo Yobu Buriburi 3 Pun Dai Shingeki,,"Slice of Life, Comedy, Ecchi, School, Seinen"
5244,8366,Crayon Shin-chan Movie 14: Densetsu wo Yobu Odore! Amigo!,,"Slice of Life, Comedy, Ecchi, School, Seinen"
5245,8367,Crayon Shin-chan Movie 16: Chou Arashi wo Yobu Kinpoko no Yuusha,,"Slice of Life, Comedy, Ecchi, School, Seinen"
5246,8368,Crayon Shin-chan Movie 17: Otakebe! Kasukabe Yasei Oukoku,,"Sci-Fi, Comedy, Seinen"
5247,8369,Crayon Shin-chan Movie 18: Chou Jikuu! Arashi wo Yobu Ora no Hanayome,,"Sci-Fi, Adventure, Comedy, Seinen"
5248,8372,Makoto-chan,,Comedy
5249,8373,Shin Mitsubachi Maya no Bouken,,"Adventure, Comedy"
5250,8375,Chogattai Majutsu Robot Ginguiser,,"Adventure, Mecha, Sci-Fi, Shounen"
5251,8394,Cyborg 009 (TV),Cyborg 009,"Action, Adventure, Mecha, Sci-Fi, Shounen"
5252,8407,Sora no Otoshimono: Forte,Heaven&#039;s Lost Property: Forte,"Comedy, Ecchi, Harem, Romance, Sci-Fi, Shounen, Supernatural"
5253,8408,Durarara!! Specials,Durarara!! Specials,"Action, Comedy, Supernatural"
5254,8409,Marie & Gali ver. 2.0,,Comedy
5255,8410,Metal Fight Beyblade: Baku,Beyblade: Metal Masters,"Adventure, Comedy, Sports"
5256,8422,Vampire Knight: Gekiai no Portrait,,"Comedy, Vampire, Shoujo"
5257,8423,Ookiku Furikabutte: Natsu no Scorebook,Big Windup!,"Comedy, Sports"
5258,8424,MM!,MM!,"Harem, Comedy, Ecchi, School"
5259,8425,Gosick,,"Mystery, Historical, Drama, Romance"
5260,8426,Hourou Musuko,Wandering Son,"Slice of Life, Drama, Romance, School"
5261,8431,Mahou no Star Magical Emi: Kumo Hikaru,,"Comedy, Shoujo, Slice of Life"
5262,8436,Animentary: Ketsudan,,"Historical, Military"
5263,8438,Pokemon Ranger: Hikari no Kiseki,Pokémon Ranger: Guardian Signs,"Adventure, Comedy, Fantasy, Kids"
5264,8440,Black Lagoon Omake,,Comedy
5265,8442,Maze☆Bakunetsu Jikuu: Tenpen Kyoui no Giant,,"Adventure, Comedy, Fantasy, Mecha, Shounen"
5266,8443,Mahou no Star Magical Emi: Semishigure,,"Comedy, Magic, Shoujo"
5267,8446,SAI: Part 1 / Revolving... to the Core,,"Fantasy, Music"
5268,8449,Togainu no Chi,Togainu no Chi,"Action, Sci-Fi, Shounen Ai"
5269,8450,Guskou Budori no Denki,The Life of Guskou Budori,Drama
5270,8451,Donguri to Yamaneko,Miyazawa Kenji Collection - The Acorns and the Wildcat,Drama
5271,8456,Queen&#039;s Blade: Utsukushiki Toushitachi,Queen&#039;s Blade: Beautiful Warriors,"Action, Adventure, Ecchi, Fantasy"
5272,8457,Yozakura Quartet: Hoshi no Umi,,"Action, Magic, Comedy, Super Power, Supernatural, Shounen"
5273,8460,Mirai Nikki,,"Action, Shounen, Supernatural"
5274,8464,Pants no Ana,,"Ecchi, Comedy, School"
5275,8465,Ichiban Ushiro no Daimaou Specials,,"Comedy, Ecchi, Fantasy, Magic, Shounen"
5276,8471,Naoko no Tropic Angel: Hyouryuu,,Hentai
5277,8475,Asura,,"Drama, Historical"
5278,8476,Otome Youkai Zakuro,Zakuro,"Demons, Historical, Military, Romance, Seinen, Supernatural"
5279,8479,Hetalia World Series,Hetalia World Series,"Comedy, Historical, Parody"
5280,8481,"""Bungaku Shoujo"" Memoire",,"Drama, Romance, School"
5281,8486,Kihei Senki Legacies,,"Fantasy, Mecha"
5282,8487,Onigamiden,Legend of the Millennium Dragon,"Action, Demons, Supernatural"
5283,8490,Digimon Adventure 3D: Digimon Grand Prix!,,"Action, Adventure, Comedy, Fantasy, Kids, Parody, Sports"
5284,8491,Digimon Savers 3D: Digital World Kiki Ippatsu!,,"Action, Adventure, Fantasy, Kids, Supernatural"
5285,8493,Gegege no Kitarou: Kitarou no Yuurei Densha,Gegege no Kitarou: Kitarou&#039;s Ghost Train,"Adventure, Super Power, Demons, Supernatural"
5286,8495,Mahoutsukai Haley no Speed Story,,"Kids, Magic, Fantasy"
5287,8496,Neko Neko Fantasia,Kitty-Cat Fantasia,Comedy
5288,8500,Haguregumo,,"Comedy, Historical, Samurai, Seinen"
5289,8503,Fushigi Mahou Fun Fun Pharmacy,,"Kids, Magic"
5290,8507,Ikkitousen: Xtreme Xecutor Specials,,"Comedy, Ecchi"
5291,8514,Break Blade 2: Ketsubetsu no Michi,Broken Blade 2,"Action, Fantasy, Mecha, Military, Shounen"
5292,8516,Baka to Test to Shoukanjuu Ni!,Baka & Test – Summon the Beasts 2,"Comedy, Super Power, Romance, School"
5293,8518,Mai-Otome Special: Otome no Inori,,"School, Slice of Life"
5294,8523,Sukeban Shoukai Cutie Lemon,,Hentai
5295,8524,The Kabocha Wine: Nita no Aijou Monogatari,,"Slice of Life, Comedy, Romance, School"
5296,8525,Kami nomi zo Shiru Sekai,The World God Only Knows,"Comedy, Harem, Romance, Shounen, Supernatural"
5297,8526,Honey Tokyo,Honey Tokyo,Sci-Fi
5298,8532,Katekyo Hitman Reborn! Special,,"Comedy, Shounen"
5299,8533,Hana no Kage,Shadow of the Cherry Blossoms,"Demons, Drama, Historical, Romance"
5300,8536,Fortune Arterial: Akai Yakusoku,,"Comedy, Romance, School, Supernatural, Vampire"
5301,8538,Gokujou!! Mecha Mote Iinchou Second Collection,The Best!! Extremely Cool Student Council President Second Collection,"Comedy, Romance, School, Shoujo"
5302,8539,Toilet no Hanako-san,,Horror
5303,8542,Shin Ace wo Nerae!,New Aim for the Ace!,"Drama, Romance, School, Shoujo, Sports"
5304,8546,"Dr. Slump Movie 02: ""Hoyoyo!"" Uchuu Daibouken","Dr. Slump: ""Hoyoyo!"" Space Adventure","Comedy, Sci-Fi, Shounen"
5305,8547,Dr. Slump Movie 05: Arale-chan Hoyoyo! Yume no Miyako Mechapolis,"Dr. Slump and Arale-chan: Hoyoyo! City of Dreams, Mechapolis","Comedy, Sci-Fi, Shounen"
5306,8548,Dr. Slump Movie 08: Arale-chan Hoyoyo!! Tasuketa Same ni Tsurerarete...,Dr. Slump and Arale-chan: Hoyoyo!! Follow the Rescued Shark...,"Comedy, Sci-Fi, Shounen"
5307,8550,Dr. Slump Movie 10: Arale no Bikkuriman,Doctor Slump: Arale&#039;s Surprise,"Comedy, Sci-Fi, Shounen"
5308,8551,Dr. Slump Movie 11: Dr. Mashirito & Abale-chan,Dr. Slump: Dr. Mashirito and Abale-chan,"Comedy, Sci-Fi, Shounen"
5309,8553,Time Bokan Series: Time Patroltai Otasukeman,,"Action, Adventure, Comedy, Sci-Fi"
5310,8554,Hashire Melos (1981),Run Melos,"Historical, Drama"
5311,8557,Shinryaku! Ika Musume,The Squid Girl,"Comedy, Shounen, Slice of Life"
5312,8560,"Kyou, Koi wo Hajimemasu",Today We Start Our Love,"Romance, School, Shoujo"
5313,8563,Chikyuu Monogatari Telepath 2500,Earth Story Telepath 2500,"Adventure, Drama, Sci-Fi"
5314,8574,Aoi Taiken,,Hentai
5315,8577,Aki-Sora: Yume no Naka,,"Ecchi, Romance, Seinen, Yuri"
5316,8584,Future War 198X-nen,Future War Year 198X,"Military, Drama"
5317,8598,Yuki,Yuki: Snow Fairy,"Adventure, Demons, Fantasy"
5318,8599,Mayoi Neko Overrun! Specials,,"Comedy, Ecchi"
5319,8603,Tegami: Haikei Juugo no Kimi e,,"School, Music, Slice of Life"
5320,8604,Oshiri Kajiri Mushi,,"Comedy, Music"
5321,8609,Detective Conan OVA 10: Kid in Trap Island,,"Adventure, Comedy, Mystery, Police, Shounen"
5322,8619,Ladies versus Butlers! Tokuten Disc Music Clip,,"Ecchi, Music"
5323,8624,Digimon Xros Wars,Digimon Fusion,"Action, Adventure, Comedy, Fantasy, Shounen"
5324,8626,Good Morning,,"Slice of Life, Music"
5325,8628,Chains & Rings,Chains & Rings,"Fantasy, Music"
5326,8630,Hidan no Aria,Aria the Scarlet Ammo,"Action, Comedy, Romance, School"
5327,8631,YanYan Machiko,,"Slice of Life, Comedy"
5328,8632,Chuuzumou,,Comedy
5329,8634,Koisuru Boukun,,"Comedy, Romance, Yaoi"
5330,8635,Shin Koihime†Musou: Live Revolution,,"Ecchi, Music"
5331,8643,Asatte Dance,Dance Till Tomorrow,"Ecchi, Comedy, Romance, Drama, Seinen"
5332,8645,Kitte no Nai Okurimono,,"Kids, Music"
5333,8646,44-hiki no Neko,,"Kids, Music"
5334,8647,Self-Portrait,Animated Self Portraits A Portrait of Kawamoto,"Comedy, Demons"
5335,8648,Break Blade Picture Drama,Broken Blade Picture Drama,"Fantasy, Comedy"
5336,8651,Newmanoid Cam: Cam Castin,,Hentai
5337,8652,Arbeit Shiyo!!,Let&#039;s Arbeit!,Hentai
5338,8653,Mahou Shoujo Isuka,,Hentai
5339,8654,I☆Can,,Hentai
5340,8655,Bijukubo,,Hentai
5341,8659,I&#039;m Here with You,,"Music, Kids"
5342,8660,Minarai Chameleon,,"Comedy, Kids, Music"
5343,8661,Chimuchimucheri ChimChimCheree,,"Music, Slice of Life, Kids"
5344,8663,Yokoo&#039;s 3 Animation Films,,"Psychological, Romance"
5345,8664,"Slime Boukenki: Umi da, Yeah!",,"Action, Adventure, Comedy, Fantasy, Game"
5346,8666,Mazinkaiser SKL,,"Adventure, Comedy, Mecha, Sci-Fi, Shounen"
5347,8667,Koi Hanabi,,"Fantasy, Music"
5348,8668,Seikon no Qwaser Picture Drama,The Qwaser Of Stigmata Picture Drama,Ecchi
5349,8669,Anokoro no Namida wa,,"Music, Slice of Life, Kids"
5350,8671,Raja Maharaja,,"Music, Slice of Life"
5351,8675,Seitokai Yakuindomo,,"Comedy, School, Shounen, Slice of Life"
5352,8676,Amagami SS,Amagami SS,"Slice of Life, Comedy, Romance, School"
5353,8677,Sangokushi (1985),,Historical
5354,8678,Sangokushi II: Amakakeru Otoko-tachi,,"Action, Historical"
5355,8679,Saboten ga Nikui,,"Comedy, Music, Kids"
5356,8680,Fuyu no Yoru no Ohanashi,,"Music, Slice of Life, Kids"
5357,8681,Kitakaze Kozou no Kantarou,,"Samurai, Music"
5358,8682,Television,,Horror
5359,8687,Doraemon (2005),,"Sci-Fi, Comedy, Kids, Shounen"
5360,8689,Born by Myself,,"Dementia, Psychological"
5361,8696,Shiroi Michi,,Music
5362,8697,Mizutori,,Music
5363,8701,Apartment!,,"Slice of Life, Comedy"
5364,8704,Uchuu Hikoushi no Uta,,"Fantasy, Music, Kids"
5365,8705,Phantom: Requiem for the Phantom Picture Drama,,Comedy
5366,8706,SOS TV Walpurgis Night Fever,,"Comedy, Sci-Fi"
5367,8707,Wakusei Robo Danguard Ace tai Konchuu Robot Gundan,,"Mecha, Sci-Fi"
5368,8709,Pokemon: Pikachu Koori no Daibouken,Pikachu&#039;s Great Ice Adventure,"Adventure, Comedy, Fantasy, Kids"
5369,8710,SOS TV Walpurgis Night Fever Episode 0,,"Comedy, Sci-Fi"
5370,8713,Akai Ito,,"Drama, Romance, Slice of Life"
5371,8716,Arigatou Thank You,,"Sci-Fi, Music, Space, Comedy, Kids"
5372,8717,Kumo ga Haretara,,Music
5373,8718,Itsumademo Tabibito,,"Drama, Music"
5374,8719,Donna Donna,,"Music, Slice of Life, Kids"
5375,8722,Ten no Kawa,,"Fantasy, Music"
5376,8723,Anime Rakugo Kan,,Comedy
5377,8724,Nobiro Nobiro Daisuki na Ki,,"Fantasy, Music"
5378,8726,Soredemo Machi wa Mawatteiru,And Yet The Town Moves,"Comedy, Slice of Life"
5379,8728,Code Geass: Hangyaku no Lelouch - Kiseki no Birthday Picture Drama,,"School, Supernatural"
5380,8729,Omoide no Album,,"Music, Slice of Life, Kids, School"
5381,8730,Metropolitan Museum,,"Music, Kids, Fantasy"
5382,8731,Akai Boushi,,"Music, Kids"
5383,8732,Yuuki Hitotsu wo Tomo ni Shite,,Music
5384,8733,Tousan no Tsukutta Uta,,"Music, Fantasy"
5385,8740,One Piece Film: Strong World Episode 0,,"Action, Adventure, Comedy, Fantasy, Shounen, Super Power"
5386,8743,Memory (ONA),,"Drama, Military, Sci-Fi, Slice of Life"
5387,8745,Seikima II Humane Society: Jinrui Ai ni Michita Shakai,,"Action, Demons, Supernatural, Fantasy"
5388,8751,Kaijuu no Ballad,,"Music, Comedy, Fantasy"
5389,8752,Message Song,,Music
5390,8754,Tales of the Abyss Special Fan Disc,,"Comedy, Slice of Life"
5391,8756,Bishoujo Senshi Sailor Moon Memorial,Pretty Soldier Sailor Moon Memorial,"Demons, Magic, Romance, Shoujo"
5392,8765,Futarigurashi,,"Comedy, Ecchi, Romance"
5393,8767,Shin Tenchi Muyou! Specials,,"Comedy, Romance, Sci-Fi, Shounen"
5394,8768,Hiyokoi,,"Romance, School, Shoujo"
5395,8769,Ore no Imouto ga Konnani Kawaii Wake ga Nai,OreImo,"Slice of Life, Comedy"
5396,8772,Happy Weekend,,"Music, Kids"
5397,8773,Nekko-kun,,"Music, Kids"
5398,8774,3-tsu no Hanashi,,"Kids, Fantasy"
5399,8777,Nobara no Julie,Julie the Wild Rose,"Adventure, Historical, Music, Drama"
5400,8778,Avignon no Hashi de,,"Music, Kids"
5401,8782,Hiyoko Gumo,,"Music, Kids, Fantasy"
5402,8783,Nezha Nao Hai,Prince Nezha&#039;s Triumph Against Dragon King,Kids
5403,8786,Inakappe Taishou,General Inakappe,"Comedy, Sports"
5404,8792,Madobe Nanami no Windows 7 de PC Jisaku Ouen Commercial!!,,Comedy
5405,8795,Panty & Stocking with Garterbelt,Panty & Stocking with Garterbelt,"Action, Comedy, Parody, Supernatural, Ecchi"
5406,8800,Senkou no Night Raid Specials,Night Raid 1931 Specials,"Action, Historical, Military, Super Power"
5407,8812,Alice SOS,,Adventure
5408,8815,Domo TV,,Comedy
5409,8829,Shounen Ashibe (TV),,"Comedy, Slice of Life"
5410,8837,Taimanin Asagi Special,,"Action, Demons, Hentai, Martial Arts, Supernatural"
5411,8839,Gundam Neo Experience 0087: Green Divers,,"Adventure, Space, Mecha"
5412,8840,Senkou no Night Raid: Yogen,Night Raid 1931: The Prophecy,"Action, Historical, Military, Super Power"
5413,8841,Kore wa Zombie Desu ka?,Is This a Zombie?,"Action, Comedy, Ecchi, Harem, Magic, Supernatural"
5414,8842,Oishinbo: Nichibei Kome Sensou,Oishinbo: The Japan-America Rice War,"Comedy, Seinen, Slice of Life"
5415,8848,"Oishinbo: Kyuukyoku tai Shikou, Chouju Ryouri Taiketsu!!",,"Comedy, Seinen, Slice of Life"
5416,8853,Chouriki Robo Galatt,,"Action, Adventure, Comedy, Mecha, Sci-Fi"
5417,8855,Eiyuu Gaiden Mozaicka,,Fantasy
5418,8857,Nichijou: Nichijou no 0-wa,My Ordinary Life Episode 0,"Comedy, School, Slice of Life"
5419,8861,"Yosuga no Sora: In Solitude, Where We Are Least Alone.",Yosuga no Sora,"Drama, Ecchi, Harem, Romance"
5420,8876,Koe de Oshigoto! The Animation,Koe de Oshigoto!,"Comedy, Ecchi, Seinen"
5421,8883,Kikou Heidan J-Phoenix: PF Lips Shoutai,,"Comedy, Mecha"
5422,8888,Code Geass: Boukoku no Akito 1 - Yokuryuu wa Maiorita,Code Geass: Akito the Exiled - The Wyvern Arrives,"Action, Mecha, Military, Sci-Fi"
5423,8889,Majo Demo Steady,,"Comedy, Magic, Romance, Ecchi"
5424,8890,Nihon-ichi no Otoko no Tamashii,,"Comedy, Romance"
5425,8891,Nihon-ichi no Otoko no Tamashii 2,,"Comedy, Romance"
5426,8894,Yume-iro Pâtissière: Mune Kyun Tropical Island!,,"Kids, School, Shoujo"
5427,8896,Natsufuku no Shoujo-tachi,,"Drama, Historical"
5428,8898,Circuit Angel: Ketsui no Starting Grid,,"Action, Sports"
5429,8899,Kaitei Shounen Marine,Marine Boy,"Action, Adventure, Kids, Sci-Fi"
5430,8900,Saru Getchu: On Air 2nd,,"Adventure, Comedy, Fantasy, Kids, Romance, Shounen"
5431,8908,Tales of Symphonia The Animation: Kaette Kita Kratos-sensei no Private Lesson,,"Comedy, School"
5432,8909,Tales of Symphonia The Animation: Tethe&#039;alla-hen Specials,,Comedy
5433,8915,Dantalian no Shoka,The Mystic Archives of Dantalian,"Action, Mystery, Historical, Supernatural"
5434,8917,Mouretsu Pirates,Bodacious Space Pirates,"Sci-Fi, Space"
5435,8918,Princess Lover! OVA,,Hentai
5436,8919,Licca-chan no Nichiyoubi,,Adventure
5437,8920,Inuki Kanako Zekkyou Collection: Gakkou ga Kowai!,,Horror
5438,8921,Believe,,"Action, Super Power, Music"
5439,8925,Kobe to Watashi,,"Comedy, Slice of Life"
5440,8928,Visions of Frank: Short Films by Japan&#039;s Most Audacious Animators,Visions of Frank,Dementia
5441,8934,Star Driver: Kagayaki no Takuto,Star Driver,"Action, Romance, Mecha, Shounen"
5442,8935,Nekketsu Uchuujin,Hot-blooded Alien,"Comedy, Sci-Fi"
5443,8936,Melody,,Drama
5444,8937,Toaru Majutsu no Index II,A Certain Magical Index II,"Action, Sci-Fi, Super Power, Magic"
5445,8939,Bohemian Rhapsody,,"Music, Sci-Fi, Space"
5446,8949,Tottoko Hamtarou OVA 2: Hamuchanzu no Takara Sagashi Daisaku - Hamuha! Suteki na Umi no Natsuyasumi,Hamtaro: Ham-Hams Ahoy!,Kids
5447,8950,Akage no Anne: Green Gables e no Michi,,"Adventure, Slice of Life, Historical, Shoujo"
5448,8952,Nougyou Musume!,,Comedy
5449,8953,Nine,,"Action, School, Shounen, Sports"
5450,8955,Senjutsu Choukoukaku Orion,,"Action, Adventure, Comedy, Fantasy, Sci-Fi"
5451,8956,Denkou Chou Tokkyuu Hikarian,,"Action, Adventure, Kids"
5452,8958,Potecco Babies,,Comedy
5453,8960,MonHun Nikki Girigiri Airou Mura: Airou Kiki Ippatsu,,"Action, Comedy"
5454,8961,Tono to Issho: Ippunkan Gekijou,,"Comedy, Samurai, Seinen"
5455,8963,Stitch!: Piko Kara no Chousenjou,,"Adventure, Comedy, Kids"
5456,8964,Stitch!: Zutto Saikou no Tomodachi,,"Adventure, Comedy, Kids"
5457,8965,Tottoko Hamtarou OVA 3: Hamuchanzu to Niji no Kuni no Oujisama - Sekai de Ichiban no Takaramono,,"Kids, Adventure, Comedy"
5458,8966,Tottoko Hamtarou OVA 4: Hamuchanzu no Mezase! Hamuhamu Kin Medal - Hashire! Hashire! Daisakusen,Hamtaro: Ham-Ham Games,"Adventure, Comedy, Kids"
5459,8968,Shogi Hour,Shogi Hour,"Parody, Game, Comedy"
5460,8972,Mahou no Princess Minky Momo vs. Mahou no Tenshi Creamy Mami,,"Magic, Shoujo"
5461,8985,Yojouhan Shinwa Taikei Specials,The Tatami Galaxy Specials,Comedy
5462,8986,Supernatural The Animation,,"Action, Demons, Horror, Supernatural"
5463,8987,Princess Knight☆Catue,,Hentai
5464,8993,Juliet,,"Hentai, Comedy, Supernatural"
5465,8995,Tales of Symphonia The Animation: Sekai Tougou-hen,,"Action, Adventure, Magic, Martial Arts, Fantasy"
5466,9000,Toaru Hikuushi e no Tsuioku,The Princess and the Pilot,"Adventure, Military, Romance"
5467,9001,Je T&#039;aime,,Sci-Fi
5468,9002,True Tears: Raigomaru to Jibeta no Monogatari,,Kids
5469,9005,To Heart 2 Adnext,,"Comedy, Harem, Romance"
5470,9006,Rei Zero,,Hentai
5471,9008,Netorare Fighter Yaricchingu!,,Hentai
5472,9009,Otome Juurin Yuugi: Maiden Infringement Play,,Hentai
5473,9013,Kuruneko Season 2,,"Comedy, Slice of Life"
5474,9014,Kuttsukiboshi,,"Romance, Supernatural, Drama, Shoujo Ai"
5475,9015,O-bake no... Holly,,"Comedy, Fantasy, Kids, Magic"
5476,9023,Katekyo Hitman Reborn!: Mr. Rebokku no Ciao Ciao Interview,,Comedy
5477,9028,Edokko Boy: Gatten Tasuke,,"Comedy, Martial Arts, Police, Sports"
5478,9032,Inazuma Eleven: Saikyou Gundan Ogre Shuurai,,"Shounen, Sports, Super Power"
5479,9035,Lupin the Third x Monkey Majik,,"Adventure, Music"
5480,9040,Mokei Senshi Gunpla Builders Beginning G,,"Action, Mecha, Sci-Fi, Shounen"
5481,9041,IS: Infinite Stratos,Infinite Stratos,"Action, Sci-Fi, Harem, Comedy, Ecchi, Mecha"
5482,9043,Majuu Sensen,,"Action, Fantasy"
5483,9045,Jack to Mame no Ki (OVA),,"Adventure, Kids, Fantasy"
5484,9047,Toaru Kagaku no Railgun: Misaka-san wa Ima Chuumoku no Mato desukara,,"Action, Sci-Fi, Super Power"
5485,9053,Ice Movie,,"Action, Sci-Fi, Military"
5486,9055,Tamayura,,"Slice of Life, Comedy, Drama"
5487,9056,Agitated Screams of Maggots,,"Dementia, Music, Horror"
5488,9062,Angel Beats! Specials,,"Action, Comedy, Supernatural, School"
5489,9063,Toaru Kagaku no Railgun: Entenka no Satsuei Model mo Raku Ja Arimasen wa ne.,,"Comedy, Ecchi"
5490,9065,Hakuouki Hekketsuroku,Hakuoki ~Demon of the Fleeting Blossom~ Record of the Jade Blood,"Action, Drama, Historical, Josei, Samurai, Supernatural"
5491,9074,Arakawa Under the Bridge x Bridge,Arakawa Under the Bridge x Bridge,"Comedy, Romance, Seinen"
5492,9077,Rokudenashi Blues,,"Sports, Comedy, School, Drama, Shounen"
5493,9078,Rokudenashi Blues 1993,,"Action, Comedy, School, Drama, Sports, Shounen"
5494,9087,"Mobile Suit SD Gundam Musha, Knight, Commando","Musha, Knight, Commando: SD Gundam Emergency Sortie","Action, Fantasy, Mecha, Comedy, Parody"
5495,9088,Saiyuuki Gaiden,,"Action, Adventure, Drama, Fantasy"
5496,9091,Ikusa Otome Suvia Special,,"Fantasy, Hentai"
5497,9095,Hitomi no Naka no Shounen: Juugo Shounen Hyouryuuki,The Story of Fifteen Boys,"Adventure, Historical"
5498,9098,Mobile Suit SD Gundam Festival,Mobile Suit SD Gundam Festival,"Action, Comedy, Fantasy, Mecha, Parody"
5499,9100,Umi Monogatari: Marin no Kore Naani?,"Umi Monogatari: Marin&#039;s ""What Is This?""",Comedy
5500,9106,Nogsaegjeoncha Haemosu,Hamos: The Green Chariot,"Action, Adventure, Fantasy, Shounen"
5501,9107,Pokemon Best Wishes!,Pokémon: Black & White,"Action, Adventure, Comedy, Fantasy, Kids"
5502,9117,Amagami SS OVA,Amagami SS,"Romance, School"
5503,9119,Chirorin Mura Monogatari,Nutsberry Town,"Kids, Slice of Life"
5504,9120,Beelzebub: Hirotta Akachan wa Daimaou!?,,"Action, Supernatural, Comedy, School, Demons, Shounen"
5505,9121,Heroman Specials,,"Action, Sci-Fi, Shounen"
5506,9124,Ookiku Furikabutte: Natsu no Taikai-hen – Mokuhyou,,"Comedy, Sports"
5507,9127,Zettai Karen Children Gentei Kaikin!! OVA Chou Sakidori Special!!,,"Action, Comedy, Shounen, Supernatural"
5508,9130,Saint Seiya: The Lost Canvas - Meiou Shinwa 2,Saint Seiya: The Lost Canvas 2,"Action, Adventure, Martial Arts, Shounen, Super Power, Supernatural"
5509,9135,Fullmetal Alchemist: The Sacred Star of Milos,Fullmetal Alchemist: The Sacred Star of Milos,"Action, Adventure, Fantasy, Magic, Comedy, Military, Drama, Shounen"
5510,9136,Kuroshitsuji II Specials,Black Butler II Specials,"Fantasy, Supernatural, Comedy, Parody, Shounen"
5511,9154,Kindaichi Shounen no Jikenbo Movie 2: Satsuriku no Deep Blue,Young Kindaichi&#039;s Casebook: Deep Blue Massacre,"Mystery, Shounen"
5512,9159,Kaibutsu Oujo (OVA),,"Action, Comedy, Horror, Supernatural, Shounen"
5513,9163,Attack No.1 (1970),,"Sports, Drama, Shoujo"
5514,9164,Attack No.1: Namida no Fushichou,,"Sports, Drama, Shoujo"
5515,9165,Attack No.1: Namida no Kaiten Receive,,"Sports, Drama, Shoujo"
5516,9166,Attack No.1: Namida no Sekai Senshuken,,"Sports, Drama, Shoujo"
5517,9167,Shukufuku no Campanella Specials,,Ecchi
5518,9170,Kimi ga Nozomu Eien: Gundam Parody,,"Mecha, Parody, Sci-Fi, Space"
5519,9172,Kaitei Sanman Mile,,"Adventure, Fantasy"
5520,9177,Burning Blood,,"Sports, Shounen"
5521,9181,Motto To LOVE-Ru,Motto To LOVE Ru,"Sci-Fi, Harem, Comedy, Ecchi, School, Shounen"
5522,9200,Dae Jang Geum: Jang Geum&#039;s Dream 2,,"Adventure, Comedy, Historical"
5523,9201,Air Gear: Kuro no Hane to Nemuri no Mori - Break on the Sky,,"Action, Comedy, Ecchi, Shounen, Sports"
5524,9202,Seikon no Qwaser: Jotei no Shouzou,The Qwaser of Stigmata: Portrait of the Empress,"Action, Super Power, Supernatural, Ecchi, Seinen"
5525,9203,K-On!!: Ura-On!!,K-ON!!: Ura-On!!,Comedy
5526,9204,Omae Umasou da na,You Are Umasou,"Action, Adventure, Fantasy, Kids"
5527,9205,Kaichuu!,,"Comedy, Seinen, Sports"
5528,9211,Shikatte Ingo: Misaki Shunin no Buka Kyouiku-hen,Scold with Dirty Words,Hentai
5529,9212,Ruri-iro Princess,,"Romance, Shoujo"
5530,9213,Kowarekake no Orgel,,"Drama, Music, Sci-Fi, Slice of Life"
5531,9220,Seikimatsu Occult Gakuin Specials,Occult Academy Specials,"Comedy, Supernatural, School"
5532,9221,Kanzen Shouri Daiteiou,,"Action, Adventure, Kids, Mecha, Sci-Fi"
5533,9228,Wan Wan Chuushingura,,"Action, Adventure, Drama, Fantasy"
5534,9232,Yebisu Celebrities 1st,,Yaoi
