,anime_id,title,title_english,genre
2424,2637,Doraemon: It&#039;s Autumn!,,"Kids, Adventure, Fantasy, Comedy, Shounen"
2425,2638,Doraemon: It&#039;s Spring!,,"Kids, Adventure, Fantasy, Comedy, Shounen"
2426,2640,Doraemon: It&#039;s Summer!,,"Kids, Adventure, Fantasy, Comedy, Shounen"
2427,2641,Doraemon: It&#039;s Winter!,Doraemon: It&#039;s Winter!,"Kids, Adventure, Fantasy, Comedy, Shounen"
2428,2644,Doraemon: Treasure of the Shinugumi Mountain,,"Adventure, Comedy, Fantasy, Kids, Shounen"
2429,2645,Dorami & Doraemons: Space Land&#039;s Critical Event,,"Kids, Adventure, Fantasy, Comedy, Sci-Fi, Shounen"
2430,2646,Dorami & Doraemons: Robot School&#039;s Seven Mysteries,,Fantasy
2431,2647,Dorami-chan: Mini-Dora SOS!!!,,"Kids, Fantasy"
2432,2648,Doraemon: 2112-nen Doraemon Tanjou,,"Kids, Fantasy, Comedy"
2433,2649,Doraemon: Obaachan no Omoide,Doraemon: A Grandmother&#039;s Recollections,"Comedy, Fantasy, Kids, Sci-Fi, Shounen"
2434,2650,"Doraemon Movie: Boku, Momotarou no Nanna no Sa",,"Adventure, Fantasy, Kids, Sci-Fi, Shounen"
2435,2651,Doraemon: Doraemon Comes Back (Movie),,"Comedy, Kids, Fantasy"
2436,2652,Doraemon: The Day When I Was Born,,"Kids, Fantasy, Comedy, Sci-Fi, Shounen"
2437,2653,Doraemon: Ganbare! Gian!!,Doraemon: Ganbare! Gian!!,"Adventure, Comedy, Fantasy, Kids, Shounen"
2438,2654,Doraemon Movie 22: Nobita to Tsubasa no Yuusha-tachi,Doraemon the Movie: Nobita and the Winged Braves,"Adventure, Fantasy, Kids, Shounen"
2439,2655,Doraemon Movie 23: Nobita to Robot Kingdom,Doraemon the Movie: Nobita in the Robot Kingdom,"Adventure, Comedy, Fantasy, Kids, Shounen"
2440,2656,Doraemon Movie 25: Nobita no Wan Nyan Jikuuden,Doraemon the Movie: Nobita in the Wan-Nyan Spacetime Odyssey,"Adventure, Comedy, Kids, Sci-Fi"
2441,2657,Doraemon Movie 08: Nobita to Ryuu no Kishi,Doraemon the Movie: Nobita and the Knights on Dinosaurs,"Adventure, Comedy, Fantasy, Kids, Shounen"
2442,2658,Doraemon Movie 09: Nobita no Parallel Saiyuuki,Doraemon the Movie: The Record of Nobita&#039;s Parallel Visit to the West,"Adventure, Fantasy, Kids, Sci-Fi, Shounen"
2443,2659,Doraemon Movie 14: Nobita to Buriki no Labyrinth,Doraemon the Movie: Nobita and the Tin Labyrinth,Fantasy
2444,2660,Doraemon: Nobita&#039;s the Night Before a Wedding,,Fantasy
2445,2661,Doraemon Movie 13: Nobita to Kumo no Oukoku,Doraemon the Movie: Nobita and the Kingdom of Clouds,"Adventure, Comedy"
2446,2662,Doraemon Movie 02: Nobita no Uchuu Kaitakushi,"Doraemon the Movie: The Records of Nobita, Spaceblazer","Adventure, Comedy, Fantasy, Kids, Shounen"
2447,2664,Doraemon Movie 19: Nobita no Nankai Daibouken,Doraemon the Movie: Nobita&#039;s Great Adventure in the South Seas,"Adventure, Comedy, Fantasy, Kids, Sci-Fi, Shounen"
2448,2665,Doraemon Movie 07: Nobita to Tetsujin Heidan,Doraemon the Movie: Nobita and the Steel Troops,"Adventure, Comedy, Kids, Fantasy, Mecha, Shounen"
2449,2666,Doraemon Movie 10: Nobita no Nippon Tanjou,Doraemon the Movie: Nobita and the Birth of Japan,"Adventure, Comedy, Fantasy, Kids, Shounen"
2450,2667,Doraemon Movie 04: Nobita no Kaitei Kiganjou,Doraemon the Movie: Nobita and the Castle of the Undersea Devil,Fantasy
2451,2668,Doraemon Movie 20: Nobita no Uchuu Hyouryuuki,Doraemon the Movie: Nobita Drifts in the Universe,"Adventure, Comedy, Fantasy, Kids, Shounen, Space"
2452,2669,Doraemon Movie 06: Nobita no Little Star Wars,Doraemon the Movie: Nobita&#039;s Little Space War,"Fantasy, Space"
2453,2670,Doraemon Movie 12: Nobita no Dorabian Nights,Doraemon the Movie: Nobita&#039;s Dorabian Nights,"Adventure, Comedy, Fantasy, Kids, Shounen"
2454,2671,Doraemon Movie 03: Nobita no Daimakyou,Doraemon the Movie: Nobita and the Haunts of Evil,Adventure
2455,2672,Doraemon Movie 05: Nobita no Makai Daibouken,Doraemon the Movie: Nobita&#039;s Great Adventure into the Underworld,Fantasy
2456,2673,Doraemon Movie 27: Nobita no Shin Makai Daibouken - 7-nin no Mahoutsukai,Doraemon the Movie: Nobita&#039;s New Great Adventure into the Underworld,"Adventure, Comedy, Fantasy"
2457,2674,Doraemon Movie 16: Nobita no Sousei Nikki,Doraemon the Movie: Nobita&#039;s Diary of the Creation of the World,"Adventure, Comedy, Fantasy, Kids, Sci-Fi, Shounen"
2458,2675,Doraemon Movie 17: Nobita to Ginga Express,Doraemon the Movie: Nobita and the Galaxy Super-express,Fantasy
2459,2676,Doraemon Movie 15: Nobita to Mugen Sankenshi,Doraemon the Movie: Nobita&#039;s Three Visionary Swordsmen,"Adventure, Fantasy, Kids, Sci-Fi, Shounen"
2460,2677,Doraemon Movie 11: Nobita to Animal Planet,Doraemon the Movie: Nobita and the Animal Planet,"Adventure, Comedy, Fantasy, Kids, Sci-Fi, Shounen"
2461,2678,Doraemon Movie 18: Nobita no Nejimaki City Boukenki,Doraemon the Movie: Nobita and the Spiral City,"Adventure, Fantasy, Kids, Shounen"
2462,2679,Teki wa Kaizoku: Neko-tachi no Kyouen,The Enemy&#039;s the Pirates!: The Cats&#039; Banquet,"Comedy, Sci-Fi"
2463,2680,One Piece: Straw Hat Theater,,"Adventure, Fantasy, Shounen"
2464,2681,Spaceship Agga Ruter,Spaceship Agga Ruter,"Comedy, Hentai, Sci-Fi, Space"
2465,2682,Aoki Densetsu Shoot! (Movie),Blue Legend Shoot!,"Action, Sports, Shounen"
2466,2683,Tokyo Majin Gakuen Kenpucho: Tou Dai Ni Maku,,"Action, Mystery, Horror, Drama, Martial Arts, Fantasy, School"
2467,2684,Buzzer Beater 2nd Season,,"Action, Sci-Fi, Sports, Shounen"
2468,2685,Tsubasa: Tokyo Revelations,Tsubasa RESERVoir CHRoNiCLE: Tokyo Revelations,"Action, Adventure, Drama, Romance, Fantasy, Shounen"
2469,2686,Tetsujin 28-gou,Gigantor,"Adventure, Mecha, Sci-Fi, Shounen"
2470,2687,Gokuu no Daibouken,Adventures of the Monkey King,"Comedy, Fantasy"
2471,2688,Akai Koudan Zillion,Zillion,"Action, Military, Sci-Fi, Adventure"
2472,2689,Akai Koudan Zillion: Utahime Yakyoku,Zillion: Burning Night,"Sci-Fi, Adventure"
2473,2690,Urban Square: Kouhaku no Tsuigeki,,"Action, Mystery, Seinen"
2474,2691,Gensei Shugoshin P-hyoro Ikka,,"Adventure, Fantasy"
2475,2692,CB Chara Go Nagai World,CB Character: Nagai Gou World,"Action, Parody, Comedy"
2476,2693,Detatoko Princess,Suddenly Princess,"Comedy, Fantasy"
2477,2694,Hidamari no Ki,Tree in the Sun,"Drama, Historical"
2478,2695,Mobile Suit Gundam 0083: The Fading Light of Zeon,Mobile Suit Gundam 0083: The Afterglow Of Zeon,"Action, Sci-Fi, Adventure, Space, Mecha"
2479,2696,Crusher Joe OVA,Crusher Joe: The OVAs,"Action, Sci-Fi, Adventure"
2480,2697,Hi-Speed Jecy,High Speed Jessie,"Action, Sci-Fi"
2481,2698,Sanctuary,Sanctuary,"Action, Police, Thriller, Drama, Seinen"
2482,2699,Uchuu Kaizoku Mito no Daibouken,Space Pirate Mito,"Action, Comedy, Sci-Fi"
2483,2700,Uchuu Kaizoku Mito no Daibouken: Futari no Joou-sama,Space Pirate Mito 2,"Action, Comedy, Sci-Fi"
2484,2702,Bakukyuu Renpatsu!! Super B-Daman,,"Game, Adventure, Kids"
2485,2703,Chousoku Spinner,Super YoYo,"Sports, Shounen"
2486,2704,Kaiketsu Jouki Tanteidan,Steam Detectives,"Action, Mecha, Mystery, Police"
2487,2705,Bakusou Kyoudai Let&#039;s & Go,,"Adventure, Cars, Sports, Shounen"
2488,2706,Bakusou Kyoudai Let&#039;s & Go WGP,,"Cars, Sports, Shounen"
2489,2707,Majime ni Fumajime Kaiketsu Zorori,,"Adventure, Kids"
2490,2709,Bakusou Kyoudai Let&#039;s & Go MAX,,"Cars, Shounen, Sports"
2491,2710,Nintama Rantarou Movie,,"Comedy, Shounen"
2492,2713,Rockman.EXE Beast+,,"Action, Adventure, Game, Mecha, Sci-Fi, Shounen"
2493,2714,Sotsugyou: Graduation,Graduation,"Drama, School"
2494,2715,Totsuzen! Neko no Kuni Banipal Witt,Catnapped,Adventure
2495,2716,Urayasu Tekkin Kazoku,,"Comedy, Shounen"
2496,2717,Ginga Tetsudou Monogatari: Eien e no Bunkiten,,"Action, Adventure, Space, Drama, Sci-Fi"
2497,2718,Umi no Triton,Triton of the Sea,"Adventure, Fantasy, Shounen"
2498,2719,MapleStory,,"Action, Kids, Fantasy, Comedy, Romance"
2499,2721,Reinou Tantei Miko,Phantom Hunter Miko,"Comedy, Hentai"
2500,2722,Crusher Joe,Crusher Joe: The Movie,"Action, Sci-Fi, Adventure, Space"
2501,2723,D4 Princess,,"Action, Sci-Fi, Comedy, Magic, Mecha"
2502,2724,Daicon Opening Animations,,"Action, Sci-Fi, Adventure, Music, Mecha"
2503,2725,Tenchi Muyou!: Galaxy Police Mihoshi Space Adventure,,"Comedy, Magic, Parody, Police, Sci-Fi, Shounen, Space"
2504,2726,Sukeban Deka,Delinquent Detective,"Action, Police, Drama, School, Shoujo"
2505,2727,Sweet Valerian,,"Action, Comedy, Magic, School, Shoujo"
2506,2728,TWO-MIX: White Reflection,,Music
2507,2729,X²: Double X,,"Music, Drama, Shoujo"
2508,2730,1+2=Paradise,,"Comedy, Ecchi, Harem, Romance, Seinen"
2509,2731,Shishunki Bishoujo Gattai Robo Z-Mind,,"Action, Parody, Mecha"
2510,2732,Baby Baachan,Baby Grandma,"Comedy, Drama"
2511,2733,MiniPato,Mobile Police Patlabor Minimum,Parody
2512,2734,Mazinkaiser: Shitou! Ankoku Dai Shogun,Mazinkaiser: Deathmatch! General Dark,"Action, Mecha"
2513,2736,Mojakou,,"Comedy, Fantasy, Sci-Fi"
2514,2737,Kouryuu no Mimi: Mina no Shou,,"Action, Super Power, Drama"
2515,2738,Kasumin 3rd Season,,"Kids, Fantasy"
2516,2739,Highschool Aurabuster: Hikari no Mezame,,"Drama, Fantasy, Super Power"
2517,2740,Monkey Turn,,"Action, Sports, Drama, Shounen"
2518,2741,Monkey Turn V,,"Action, Sports, Drama, Shounen"
2519,2742,Omoikkiri Kagaku Adventure Sou Nanda!,Full-Blast Science Adventure: So That&#039;s How It Is!,"Comedy, Kids, Sci-Fi"
2520,2743,Mobile Suit Gundam SEED: SEED Supernova - Tanekyara Gekijou,,"Parody, Comedy"
2521,2744,Potemayo,,"Comedy, School, Seinen"
2522,2745,Jigoku Sensei Nube OVA,Hell Teacher Nube,"Action, Supernatural, Comedy, School, Demons, Horror, Shounen"
2523,2746,Vexille: 2077 Nihon Sakoku,Vexille,"Action, Military, Sci-Fi"
2524,2747,Tetsuwan Atom,Astro Boy,"Action, Adventure, Drama, Mecha, Sci-Fi, Shounen"
2525,2748,Dash! Kappei,,"Comedy, Sports, Ecchi, Shounen"
2526,2749,Heisei Inu Monogatari Bow,Heisei Period Dog Tale Bow,"Adventure, Comedy"
2527,2751,Miyori no Mori,Miyori&#039;s Forest,"Slice of Life, Fantasy, Drama"
2528,2752,Tennis no Ouji-sama: Zenkoku Taikai-hen - Semifinal,,"Action, Comedy, Sports"
2529,2753,Ushiro no Shoumen Daare,Who&#039;s Left Behind?,"Historical, Drama"
2530,2754,Cleopatra D.C.,,"Action, Adventure, Sci-Fi"
2531,2755,Cleopatra,Cleopatra: Queen of Sex,"Sci-Fi, Hentai, Historical"
2532,2756,Cheonnyeon-yeowoo Yeowoobi,,"Sci-Fi, Drama, Fantasy"
2533,2757,Juuni Senshi Bakuretsu Eto Ranger,,"Action, Fantasy, Comedy"
2534,2758,Shippuu! Iron Leaguer,,"Sci-Fi, Sports, Mecha, Shounen"
2535,2759,Evangelion: 1.0 You Are (Not) Alone,Evangelion: 1.0 You Are (Not) Alone,"Action, Sci-Fi, Mecha"
2536,2760,Densetsu Kyojin Ideon: Sesshoku-hen,The Ideon: A Contact,"Sci-Fi, Space, Drama, Mecha"
2537,2761,Densetsu Kyojin Ideon: Hatsudou-hen,The Ideon: Be Invoked,"Drama, Mecha, Sci-Fi, Space"
2538,2762,Igano Kabamaru,,"Action, Adventure, Comedy, Romance, School, Shounen"
2539,2765,Momotarou: Umi no Shinpei,Momotaro: Sacred Sailors,"Action, Military"
2540,2766,Super Doll Licca-chan,,"Adventure, Magic, Comedy"
2541,2767,Taneyamagahara no Yoru,,"Fantasy, Kids, Psychological, Slice of Life"
2542,2768,CLAMP in Wonderland 2,,"Action, Fantasy, Magic, Comedy, Romance, Music, Drama"
2543,2769,Galactic Patrol Lensman,,"Action, Adventure, Sci-Fi"
2544,2770,SF Shinseiki Lensman,,"Action, Sci-Fi, Adventure, Space"
2545,2771,Chou Kuse ni Narisou,I&#039;ll Make a Habit of It,"Slice of Life, Comedy, Romance, School, Shoujo"
2546,2772,Juushin Enbu: Hero Tales,Hero Tales,"Action, Fantasy, Shounen"
2547,2775,Genocyber,,"Action, Sci-Fi, Horror, Psychological, Mecha"
2548,2776,Generation of Chaos,,"Action, Adventure, Demons, Fantasy, Magic"
2549,2777,Generation of Chaos Next: Chikai no Pendant,,"Action, Military, Adventure, Romance, Fantasy"
2550,2778,Generation of Chaos III: Toki no Fuuin,,"Action, Adventure, Fantasy, Magic"
2551,2779,Sotsugyou M: Ore-tachi no Carnival,,"Drama, School"
2552,2780,Kyoufu no Bio Ningen Saishuu Kyoushi,Ultimate Teacher,"Action, Adventure, Comedy, School, Supernatural"
2553,2781,Saint Luminous Jogakuin,St. Luminous Mission High School,"Mystery, Psychological, Supernatural"
2554,2782,Fire Emblem,Fire Emblem,"Action, Adventure, Fantasy, Magic, Shounen"
2555,2783,Oyayubi Hime Monogatari,Thumbelina: A Magical Story,"Adventure, Fantasy, Shoujo"
2556,2784,Gift: Eternal Rainbow Special,,"Comedy, Ecchi, Harem, Magic, Romance"
2557,2785,OZ,,"Action, Military, Sci-Fi, Drama, Shoujo"
2558,2786,Bakegyamon,,"Action, Game, Shounen"
2559,2787,Shakugan no Shana II (Second),Shakugan no Shana: Season II,"Action, Drama, Fantasy, Romance, School, Supernatural"
2560,2788,Stratosphera no Yousei,Nymphs of the Stratosphere,"Drama, Hentai, Romance, Sci-Fi"
2561,2789,B-Legend! Battle B-Daman,Battle B-Daman,"Game, Adventure, Kids, Fantasy"
2562,2790,Oira Sukeban,,"Comedy, Ecchi, School"
2563,2791,Makasete Iruka!,,"Action, Comedy, School"
2564,2792,Panzer Dragoon,,"Adventure, Fantasy"
2565,2793,Hi no Tori 2772: Ai no CosmoZone,,"Sci-Fi, Adventure, Space, Drama, Romance, Fantasy"
2566,2794,Kussetsu,,Hentai
2567,2795,Dragonaut: The Resonance,Dragonaut - The Resonance,"Action, Drama, Fantasy, Mecha, Romance, Sci-Fi"
2568,2796,Afro-Ken,,"Comedy, Kids"
2569,2797,Koukou Tekken-den Tough,Shootfighter Tekken,"Action, Martial Arts, Shounen"
2570,2798,Hatsu Inu The Animation,,Hentai
2571,2799,Hello! Sandybell,,"Adventure, Romance, Shoujo"
2572,2800,Candy Candy,,"Slice of Life, Drama, Shoujo"
2573,2801,Candy Candy: Haru no Yobigoe,Candy Candy: The Call of Spring,"Slice of Life, Drama, Shoujo"
2574,2802,Candy Candy: Candy no Natsu Yasumi,Candy Candy: Candy&#039;s Summer Vacation,"Slice of Life, Drama, Shoujo"
2575,2803,Densetsu no Yuusha Da Garn,,"Mecha, Sci-Fi, Shounen"
2576,2804,Hana no Mahoutsukai Mary Bell,,"Adventure, Magic, Fantasy, Shoujo"
2577,2805,Onegai! Samia Don,,"Kids, Slice of Life, Fantasy, Magic, Comedy"
2578,2806,Yadamon,Yadamon: Magical Dreamer,"Adventure, Comedy, Fantasy"
2579,2808,Irregular Hunter X: The Day of Sigma,Megaman X - The Day of Sigma,"Action, Sci-Fi, Mecha, Shounen"
2580,2809,Fuusen Shoujo Temple-chan,Temple the Balloonist,"Adventure, Comedy, Kids"
2581,2810,Anime Himitsu no Hanazono,The Secret Garden,"Kids, Historical, Drama, Shoujo"
2582,2811,Soratobu Yuureisen,,"Adventure, Drama, Mecha, Sci-Fi"
2583,2813,Chiisana Ahiru no Ooki na Ai no Monogatari: Ahiru no Kwak,,"Adventure, Fantasy, Comedy, Drama, Kids"
2584,2814,Dondon Domeru to Ron,Wowser,"Comedy, Kids"
2585,2815,Geragera Boes Monogatari,Ox Tales,"Comedy, Kids"
2586,2816,Toushou Daimos,Daimos,"Adventure, Drama, Mecha, Romance, Sci-Fi, Shounen"
2587,2817,Cinderella Monogatari,The Story of Cinderella,"Kids, Adventure, Fantasy, Romance"
2588,2818,Madou King Granzort,Mado King Granzort,"Action, Sci-Fi, Comedy, Magic, Fantasy, Mecha, Shounen"
2589,2819,Dragon Quest: Abel Yuusha Densetsu,Dragon Warrior,"Action, Adventure, Fantasy, Shounen"
2590,2820,Time Travel Tondekeman!,Time Quest,"Action, Kids, Adventure, Comedy"
2591,2821,Bad End,Voyeur&#039;s Digest,Hentai
2592,2822,Bamboo Bears,,Comedy
2593,2823,Barbapapa,Barbapapa,"Fantasy, Comedy"
2594,2824,Barbapapa Sekai wo Mawaru,Barbapapa Around the World,"Adventure, Comedy"
2595,2825,Arabian Nights: Sindbad no Bouken (TV),,"Adventure, Fantasy, Magic, Romance"
2596,2826,Oz no Mahoutsukai (1986),The Wonderful Wizard of Oz,"Adventure, Kids, Fantasy"
2597,2827,Calimero,,Comedy
2598,2828,Ie Naki Ko,,"Adventure, Drama, Historical, Kids, Slice of Life"
2599,2829,Ie Naki Ko Remy,Sans Famille,"Adventure, Slice of Life, Historical, Drama"
2600,2830,Chibikko Remi to Meiken Kapi,,"Slice of Life, Adventure, Drama"
2601,2831,Ie Naki Ko (Movie),,"Slice of Life, Adventure, Drama"
2602,2832,Ani*Kuri15,,"Slice of Life, Adventure, Fantasy, Magic, Game, Martial Arts, Comedy, Mecha, Super Power, Supernatural, School, Drama, Sci-Fi"
2603,2833,Gulliver no Uchuu Ryokou,,"Adventure, Sci-Fi"
2604,2834,Miracle☆Girls,,"Drama, Magic, Shoujo"
2605,2835,Patalliro!,,"Adventure, Comedy, Romance, Shoujo, Shounen Ai"
2606,2836,Chiisana Viking Vickie,,"Adventure, Comedy, Historical, Kids"
2607,2837,Ariel Deluxe,,"Action, Comedy, Mecha, Sci-Fi"
2608,2838,Toushin Toshi II,Tournament of the Gods: Title Match,"Adventure, Fantasy, Hentai, Romance"
2609,2839,Ariel Visual,,"Action, Comedy, Mecha, Sci-Fi"
2610,2840,Youkoso Lodoss-tou e!,Welcome to Lodoss Island!,"Comedy, Parody"
2611,2841,Kuro Ai: Hitoyozumakan Inkou Rannyuuroku,Dark Love,Hentai
2612,2842,Pokemon Fushigi no Dungeon: Shutsudou Pokemon Kyuujotai Ganbaruzu!,Pokemon Mystery Dungeon: Team Go-Getters Out of the Gate!,"Adventure, Fantasy"
2613,2847,Pokemon Diamond & Pearl: Dialga vs. Palkia vs. Darkrai,Pokemon: The Rise Of Darkrai,"Action, Adventure, Comedy, Drama, Fantasy, Kids"
2614,2848,Kappa no Coo to Natsuyasumi,Summer Days with Coo,"Adventure, Shounen"
2615,2851,Ninkuu (Movie),,"Action, Adventure, Comedy, Historical, Martial Arts, Shounen"
2616,2852,Accelerando: Datenshi-tachi no Sasayaki,,Hentai
2617,2858,Ikusa Otome Valkyrie,Ride of the Valkyrie,Hentai
2618,2859,Ikusa Otome Valkyrie Shinshou,,Hentai
2619,2861,Seifuku Shojo The Animation,,Hentai
2620,2862,Tokineiro,,Hentai
2621,2863,21-ji no Onna: Newscaster Katsuragi Miki,,Hentai
2622,2864,2x1,Four Play,Hentai
2623,2866,Ane☆Haramix,,Hentai
2624,2867,Ane Jiru The Animation: Shirakawa Sanshimai ni Omakase,,Hentai
2625,2868,Kazama Mana,,Hentai
2626,2869,Nanase Ren,,Hentai
2627,2870,Yagami Yuu,Night Shift Nurses: Yagami Yu,Hentai
2628,2871,Bakunyuu Oyako,,"Hentai, School"
2629,2872,Asgaldh: The Distortion Testament,F-Force,Hentai
2630,2873,Bible Black Only Version,,Hentai
2631,2874,Charm Point 1: Sister&#039;s Rondo,,Hentai
2632,2875,Chikan Monogatari,Legend of the Pervert,Hentai
2633,2876,Hoshi no Orpheus,Winds of Change,"Fantasy, Kids"
2634,2881,Chinmoku no Kantai,Silent Service,"Action, Military, Drama, Seinen"
2635,2882,Anime Oyako Gekijou,Superbook,"Kids, Adventure, Fantasy, Historical, Sci-Fi"
2636,2883,Iyashite Agerun Saiyuuki,Karma Saiyuki,"Hentai, Parody"
2637,2884,Aachi wa Ssipak,Aachi and Ssipak,"Action, Comedy"
2638,2885,Ganbare Goemon,Legend of the Mystical Ninja,"Comedy, Shounen"
2639,2889,Bleach Movie 2: The DiamondDust Rebellion - Mou Hitotsu no Hyourinmaru,Bleach the Movie: The DiamondDust Rebellion,"Action, Adventure, Supernatural, Shounen"
2640,2890,Gake no Ue no Ponyo,Ponyo,"Adventure, Fantasy"
2641,2891,Iblard Jikan,,Fantasy
2642,2892,Hakushon Daimaou,Bob in the Bottle,"Comedy, Fantasy"
2643,2894,Kinbaku no Yakata: Ryakudatsu,Bondage Mansion,Hentai
2644,2895,Kujiratori,The Whale Hunt,Adventure
2645,2896,Houkago: Nureta Seifuku,After Class Lesson,Hentai
2646,2897,Nandarou,,Comedy
2647,2899,Higurashi no Naku Koro ni Special: Nekogoroshi-hen,,Mystery
2648,2901,Kochira Katsushikaku Kameari Kouenmae Hashutsujo The Movie,Kameari Park Precinct,"Action, Comedy, Mystery, Police"
2649,2903,Sakigake!! Otokojuku,Charge!! Men&#039;s Private School,"Action, Comedy, Martial Arts, School, Shounen"
2650,2904,Code Geass: Hangyaku no Lelouch R2,Code Geass: Lelouch of the Rebellion R2,"Action, Military, Sci-Fi, Super Power, Drama, Mecha"
2651,2905,Ikkitousen: Dragon Destiny Specials,,"Super Power, Ecchi, Martial Arts, School"
2652,2906,Rokushin Gattai GodMars: Juunana-sai no Densetsu,,"Action, Sci-Fi, Space, Mecha"
2653,2907,Cyborg Kuro-chan,,"Comedy, Sci-Fi"
2654,2910,Koi Koi 7 Specials,Love Love 7 DVD Specials,"Comedy, Ecchi"
2655,2911,Kyoushirou to Towa no Sora Specials,,"Drama, Magic, Romance, Shounen"
2656,2912,Ohayo! Spank,,"Comedy, Slice of Life"
2657,2913,Daisougen no Chiisana Tenshi: Bush Baby,"Bush Baby, Little Angel of the Great Plains","Adventure, Drama"
2658,2915,Chikyuu ga Ugoita Hi,The Day the Earth Moved,Drama
2659,2916,Genki Bakuhatsu Ganbaruger,Energetic Bomb Ganbaruger,"Mecha, Shounen"
2660,2917,Seijun Kango Gakuin,Nurse Me!,"Comedy, Hentai"
2661,2920,Ashita no Joe (Movie),,"Action, Drama, Shounen, Sports"
2662,2921,Ashita no Joe 2,Rocky Joe 2,"Action, Drama, Shounen, Slice of Life, Sports"
2663,2922,Ashita no Joe 2 (Movie),,"Drama, Sports"
2664,2923,Shugo Chara!,Shugo Chara!,"Comedy, Magic, School, Shoujo"
2665,2924,ef: A Tale of Memories.,ef - a tale of memories.,"Mystery, Drama, Romance"
2666,2926,Myself; Yourself,Myself; Yourself,"Drama, Romance, School"
2667,2927,Kimikiss Pure Rouge,Kimikiss: Pure Rouge,"Drama, Romance, School"
2668,2928,.hack//G.U. Returner,,"Magic, Adventure, Fantasy, Game, Sci-Fi, Drama"
2669,2929,Moonlight Mile 2nd Season: Touch Down,,"Adventure, Drama, Sci-Fi, Space"
2670,2931,Mokke,,"Slice of Life, Supernatural, Mystery"
2671,2933,Mirai Keisatsu Urashiman,Future Police Urashiman,"Action, Sci-Fi, Comedy, Police"
2672,2934,Shiawase Sou no Okojo-san,,Comedy
2673,2935,Ryokan Shirasagi,Swallowtail Inn,Hentai
2674,2936,Private Emotion,,Hentai
2675,2937,Bishoujo Senshi Sailor Moon R: Make Up! Sailor Senshi,,Shoujo
2676,2938,Idol Densetsu Eriko,,Music
2677,2941,Elysium,,"Action, Mecha, Sci-Fi"
2678,2942,Sketchbook: Full Color&#039;s,Sketchbook ~full color&#039;s~,"Slice of Life, Comedy"
2679,2943,Inbaku Gakuen,School of Bondage,"Hentai, School"
2680,2944,Seisai,Perverse Investigations,"Dementia, Fantasy, Hentai, Horror"
2681,2945,Hitozuma Ryoujoku Sankanbi,Desperate Carnal Housewives,Hentai
2682,2946,Angel Core: Tenshi-tachi no Sumika,Angel Core,"Action, Mecha, Hentai, Military, Historical"
2683,2947,Ojamajo Doremi Sharp Movie,,"Kids, Magic, Shoujo"
2684,2948,Motto! Ojamajo Doremi: Kaeru Ishi no Himitsu,More! Ojamajo Doremi: Secret of the Frog Stone,"Kids, Magic, Shoujo"
2685,2950,Doubutsu no Mori,,"Kids, Slice of Life"
2686,2951,Gintama: Nanigoto mo Saiyo ga Kanjin nano de Tasho Senobisuru Kurai ga Choudoyoi,,"Action, Sci-Fi, Comedy, Historical, Parody, Samurai, Mecha, Shounen"
2687,2952,Final Fantasy VII: Advent Children Complete,,"Action, Fantasy, Super Power"
2688,2953,Egao,,"Music, Slice of Life, Kids"
2689,2954,Maria-sama ga Miteru 3rd Specials,Keep it a Secret from Maria-sama,Comedy
2690,2955,Hana no Joshi Announcer: Newscaster Etsuko,Foxy Nudes,Hentai
2691,2956,Shin-ban Megami Tantei Vinus File,The Venus Files,Hentai
2692,2957,Okusama wa Mahoutsukai,Enspelled,Hentai
2693,2958,Hitozuma Cosplay Kissa,Cosplay Cafe,Hentai
2694,2959,Utsukushiki Sei no Dendoushi Reirei,Rei Rei,"Hentai, Yuri"
2695,2960,Kininaru Roommate,The Roommate,Hentai
2696,2961,Digimon Adventure Movie,Digimon: The Movie,"Action, Fantasy, Kids, Sci-Fi"
2697,2962,Digimon Adventure 02 Movies,Digimon: The Movie,"Adventure, Fantasy, Kids, Sci-Fi"
2698,2963,Minami-ke,,"Slice of Life, Comedy, School"
2699,2964,Blue Drop: Tenshi-tachi no Gikyoku,Blue Drop,"Sci-Fi, Drama, Shoujo Ai"
2700,2965,Suteki Tantei Labyrinth,Fantastic Detective Labyrinth,"Mystery, Sci-Fi"
2701,2966,Ookami to Koushinryou,Spice and Wolf,"Adventure, Fantasy, Historical, Romance"
2702,2967,Saishuu Shiken Kujira,,"Comedy, Ecchi, Mystery, School, Supernatural"
2703,2969,Appleseed Saga Ex Machina,Appleseed: Ex Machina,"Action, Mecha, Military, Sci-Fi"
2704,2970,Night Wizard,,"Adventure, Fantasy, Magic, Shounen"
2705,2971,Kyou kara Maou! R,,"Adventure, Comedy, Demons, Fantasy, Shoujo"
2706,2972,Kindan no Mokushiroku: Crystal Triangle,Crystal Triangle,"Adventure, Military, Demons, Mystery"
2707,2973,Fire Tripper,Fire Tripper,"Fantasy, Sci-Fi"
2708,2974,The Humanoid: Ai no Wakusei Lezeria,The Humanoid,"Space, Mecha, Drama, Sci-Fi"
2709,2977,Youjuu Sensen Adventure Kid,Adventure Kid,"Fantasy, Hentai, Demons, Horror"
2710,2978,Shin Getter Robo,New Getter Robo,"Action, Adventure, Mecha, Sci-Fi, Demons, Horror, Shounen"
2711,2979,Akiko,,Hentai
2712,2980,Kuusou Kagaku Sekai Gulliver Boy,Fantascience World Gulliver Boy,"Action, Adventure, Fantasy, Magic, Mecha"
2713,2981,Chika Gentou Gekiga: Shoujo Tsubaki,Midori,"Drama, Historical, Horror"
2714,2982,Yuuwaku,Temptation,"Hentai, School"
2715,2983,Digital Devil Story: Megami Tensei,,"Adventure, Mystery, Horror, Demons, Psychological, Supernatural, Drama, Fantasy, School"
2716,2985,Majin Tantei Nougami Neuro,Neuro: Supernatural Detective,"Mystery, Comedy, Demons, Supernatural, Shounen"
2717,2986,Bamboo Blade,Bamboo Blade,"Comedy, School, Seinen, Sports"
2718,2987,Ginga Hyouryuu Vifam,,"Action, Sci-Fi, Adventure, Space, Mecha"
2719,2988,Mahou Shoujo Ai,,"Action, Hentai, Horror, Supernatural"
2720,2989,Classmate no Okaasan,My Classmate&#039;s Mother,"Hentai, School"
2721,2990,Mini Skirt Gakuen,Girl&#039;s Locker Room Lust,Hentai
2722,2991,Harumi-chan no Oita,,Hentai
2723,2993,Rosario to Vampire,Rosario + Vampire,"Harem, Comedy, Romance, Ecchi, Vampire, Fantasy, School, Shounen"
2724,2994,Death Note: Rewrite,Death Note: Relight,"Mystery, Police, Psychological, Supernatural, Thriller"
2725,2997,Hi no Tori: Houou-hen,Phoenix: Karma Chapter,"Drama, Fantasy, Historical"
2726,2998,Hi no Tori: Uchuu-hen,The Phoenix -Space-,"Sci-Fi, Space, Drama, Fantasy"
2727,2999,Hi no Tori: Yamato-hen,The Phoenix: Chapter of Yamato,"Drama, Historical"
2728,3000,Taiho Shichau zo: Full Throttle,You&#039;re Under Arrest: Full Throttle,"Action, Comedy, Police, Shounen"
2729,3001,Moyashimon,,"Comedy, School, Supernatural"
2730,3002,Gyakkyou Burai Kaiji: Ultimate Survivor,Kaiji: Ultimate Survivor,"Game, Psychological, Seinen, Thriller"
2731,3003,Yumedamaya Kidan,,"Drama, Fantasy"
2732,3004,Saint Beast: Ikusen no Hiru to Yoru-hen,,"Magic, Fantasy"
2733,3005,Shadow Skill,,"Adventure, Drama, Fantasy, Shounen"
2734,3006,Atashin&#039;chi,My Family,"Comedy, Slice of Life"
2735,3007,Bronze: Kouji Nanjo Cathexis,,"Music, Shounen Ai"
2736,3008,Time Bokan Series: Yatterman,,"Adventure, Comedy, Mecha"
2737,3009,Tiger Mask,Tiger Mask,"Action, Drama, Shounen, Sports"
2738,3010,Kaiketsu Zorro,The Magnificent Zorro,"Adventure, Historical, Shounen"
2739,3011,Yotsunoha,,"Romance, School"
2740,3012,Gekitou! Crush Gear Turbo,,"Sports, Shounen"
2741,3014,Ginga Eiyuu Densetsu: Waga Yuku wa Hoshi no Taikai,,"Action, Military, Sci-Fi, Space"
2742,3015,Ginga Eiyuu Densetsu Gaiden: Ougon no Tsubasa,,"Action, Drama, Military, Sci-Fi, Shounen, Space"
2743,3016,Ginga Eiyuu Densetsu: Arata Naru Tatakai no Overture,,"Action, Space, Military, Drama, Sci-Fi"
2744,3019,Lupin III: Kiri no Elusive,Lupin III: Elusiveness of the Fog,"Action, Adventure, Mystery, Comedy, Seinen"
