,anime_id,title,title_english,genre
7909,23229,Meshimase Lodoss-tou Senki: Sorette Oishii no?,,Comedy
7910,23233,Shinmai Maou no Testament,The Testament of Sister New Devil,"Action, Harem, Demons, Romance, Ecchi, Fantasy"
7911,23237,Chuunibyou demo Koi ga Shitai! Ren Specials,"Love, Chunibyo & Other Delusions: Heart Throb Specials",Comedy
7912,23247,Oshaburi Announcer,,Hentai
7913,23249,Uchuu Senkan Yamato 2199: Hoshimeguru Hakobune,,"Action, Military, Sci-Fi, Space, Drama"
7914,23251,Gugure! Kokkuri-san,GUGURE! KOKKURI-SAN,"Comedy, Shounen, Supernatural"
7915,23259,Gundam: G no Reconguista,Gundam Reconguista in G,"Action, Sci-Fi, Space, Mecha"
7916,23265,Genroku Koi Moyou: Sankichi to Osayo,Sankichi and Osayo: A Genroku Romance,"Adventure, Romance"
7917,23269,Hello!! Kiniro Mosaic,Hello!! KINMOZA!,"Slice of Life, Comedy, School, Seinen"
7918,23273,Shigatsu wa Kimi no Uso,Your Lie in April,"Drama, Music, Romance, School, Shounen"
7919,23275,Tsubu★Doll,,Music
7920,23277,Saenai Heroine no Sodatekata,Saekano: How to Raise a Boring Girlfriend,"Harem, Comedy, Romance, Ecchi, School"
7921,23279,Gyakusatsu Kikan,Genocidal Organ,"Military, Sci-Fi, Psychological"
7922,23281,Psycho-Pass 2,Psycho-Pass 2,"Action, Sci-Fi, Police, Psychological"
7923,23283,Zankyou no Terror,Terror in Resonance,"Mystery, Psychological, Thriller"
7924,23285,Paulette no Isu,Paulette&#039;s Chair,"Slice of Life, Comedy, Kids"
7925,23289,Gekkan Shoujo Nozaki-kun,Monthly Girls&#039; Nozaki-kun,"Comedy, Romance, School"
7926,23293,Lupin the IIIrd: Jigen Daisuke no Bohyou,Lupin III: Jigen&#039;s Gravestone,"Action, Adventure, Comedy, Drama, Seinen"
7927,23299,Pokemon Best Wishes! Season 2: Decolora Adventure - Iris vs. Ibuki! Dragon Master e no Michi!!,,"Action, Adventure, Comedy, Fantasy, Kids"
7928,23301,Pokemon XY: Mega Evolution,,"Action, Adventure, Comedy, Kids, Fantasy"
7929,23305,Shin Sei Yariman Gakuen Enkou Nikki The Animation,,Hentai
7930,23309,Rail Wars!,Rail Wars!,"Action, Harem, Police, Ecchi"
7931,23311,Garo: Honoo no Kokuin,GARO: THE ANIMATION,"Action, Demons, Supernatural, Magic, Fantasy"
7932,23317,Kuroshitsuji: Book of Murder,Black Butler: Book of Murder,"Comedy, Demons, Fantasy, Historical, Mystery, Shounen, Supernatural"
7933,23319,"Suisei no Gargantia: Meguru Kouro, Haruka",Gargantia on the Verdurous Planet: Far Beyond the Voyage,"Action, Adventure, Mecha, Sci-Fi"
7934,23321,Log Horizon 2nd Season,Log Horizon 2,"Action, Adventure, Fantasy, Game, Magic"
7935,23325,Shirogane no Ishi: Argevollen,Argevollen,"Action, Mecha"
7936,23327,Space☆Dandy 2nd Season,Space Dandy 2nd Season,"Space, Comedy, Sci-Fi"
7937,23333,DRAMAtical Murder,DRAMAtical Murder,"Action, Sci-Fi, Super Power, Psychological"
7938,23341,Mahouka Koukou no Rettousei: Yoku Wakaru Mahouka!,The irregular at magic high school: Get to Know Magic Studies!,"Magic, Comedy"
7939,23359,Code Geass: Boukoku no Akito 2 - Hikisakareshi Yokuryuu Picture Drama,Code Geass: Akito the Exiled 2 - The Torn-Up Wyvern Picture Drama,"Action, Comedy, Military"
7940,23361,Bakuman. 3rd Season Specials,,Comedy
7941,23363,Ore no Imouto ga Konnani Kawaii Wake ga Nai.: Ore no Imouto ga Konnani Eroge na Wake Nai,,"Comedy, Romance"
7942,23365,By Your Side,,Music
7943,23367,Kitakubu Katsudou Kiroku: Miniature Theater,,"Comedy, School"
7944,23369,Bakuman. 2nd Season Special,,Comedy
7945,23375,Minarai Diva,,Music
7946,23383,D-Fang!: Water!!,,"Game, Comedy, Seinen"
7947,23385,Kyoukai no Kanata: Shinonome,Beyond the Boundary: Daybreak,"Fantasy, Slice of Life, Supernatural"
7948,23387,Master of Torque,,"Action, Sci-Fi"
7949,23399,Minami no Shima no Dera-chan,,"Comedy, Slice of Life"
7950,23401,Tobacco wa Dasai,,"School, Slice of Life"
7951,23405,Tokyo Ravens: Kon ga Oshiete Moshi Agemasu! Maru Wakari Tokyo Ravens,,"Shounen, Supernatural"
7952,23409,Duel Masters VS,,"Action, Adventure, Comedy, Shounen"
7953,23421,Re:␣Hamatora,Re: Hamatora: Season 2,"Mystery, Comedy, Super Power, Drama"
7954,23423,Mujaki no Rakuen,Paradise of Innocence,"Comedy, Ecchi, Romance, School, Seinen"
7955,23425,Karneval (TV) Specials,,"Comedy, Josei"
7956,23427,Oneechan ga Kita Special,,"Comedy, Slice of Life"
7957,23433,Shin Strange+,,"Slice of Life, Comedy, Josei"
7958,23439,Toki wa Meguru: Tokyo Station,Passage of Time: Tokyo Station,Slice of Life
7959,23441,Love Stage!!: Chotto Janakutte,,"Comedy, Romance, Shounen Ai"
7960,23447,"Ano Natsu de Matteru: Bokutachi wa Koukou Saigo no Natsu wo Sugoshinagara, Ano Natsu de Matteiru.",,"Comedy, Drama, Romance, Sci-Fi, Slice of Life"
7961,23459,Sekai Seifuku: Bouryaku no Zvezda - Shin Zvezda Daisakusen,,"Action, Comedy, Fantasy"
7962,23475,Saimin Jutsu Zero Special,,Hentai
7963,23477,Kakushi Dere Special,,Hentai
7964,23479,Itadaki! Seieki♥ Special,,Hentai
7965,23483,Decorator,,Music
7966,23487,Witch Craft Works Specials,,"Magic, Comedy"
7967,23499,Gakumon!: Ookami Shoujo wa Kujikenai,,"Comedy, School, Shounen"
7968,23517,Calligraffiti,,Music
7969,23519,Enbi,,Hentai
7970,23539,Gudetama,,"Comedy, Kids"
7971,23551,Choboraunyopomi Gekijou Dai Ni Maku Ai Mai Mii: Mousou Catastrophe,Ai-Mai-Mi Mousou Catastrophe,"Comedy, Slice of Life"
7972,23555,Neko no Dayan,,"Kids, Magic"
7973,23579,12-sai.,Age 12,"Romance, School, Shoujo"
7974,23581,Romeo no Aoi Sora Specials,,"Adventure, Drama, Historical, Slice of Life"
7975,23583,Akage no Anne Specials,,"Drama, Historical, Kids, Shoujo, Slice of Life"
7976,23587,The iDOLM@STER Cinderella Girls,THE IDOLM@STER CINDERELLA GIRLS,"Music, Comedy, Drama"
7977,23595,Seihou Tenshi Angel Links: Meifon no Special Kaisetsu Corner,,"Comedy, Sci-Fi, Space"
7978,23597,Legend of Basara: Shinbashi Theater,,Comedy
7979,23605,Ninja Slayer From Animation,Ninja Slayer From Animation,Action
7980,23619,Haiyore! Nyaruko-san W OVA,,"Comedy, Ecchi, Parody"
7981,23621,"Sagashita no wa Oheya, Mitsuketa no wa Mirai",,"Romance, Slice of Life"
7982,23623,Non Non Biyori Repeat,Non Non Biyori Repeat,"Comedy, School, Seinen, Slice of Life"
7983,23627,Aoki Hagane no Arpeggio: Ars Nova - Kirikumas,,"Comedy, Parody"
7984,23665,Renai Fuyou Gakuha The Animation,,Hentai
7985,23673,Ookami Shoujo to Kuro Ouji,Wolf Girl & Black Prince,"Comedy, Romance, School, Shoujo"
7986,23679,Strange+ Special,,"Slice of Life, Comedy, Josei"
7987,23697,Kara no Kyoukai: Manner Movies,the Garden of sinners Pre-show Reminder,"Action, Comedy"
7988,23701,Toradora! Recap,,"Slice of Life, Comedy, Romance, School"
7989,23703,Gatchaman Crowds: Embrace,,"Adventure, Sci-Fi"
7990,23719,Rennyuu Tales The Animation,,Hentai
7991,23725,Strike Witches: Operation Victory Arrow,,"Action, Military, Sci-Fi, Magic"
7992,23733,Kosys! Kochira Keihime Tetsudou: Kouhou System-ka,,"Comedy, Slice of Life"
7993,23735,Kenzen Robo Daimidaler Specials,,"Ecchi, Comedy, Mecha, Seinen"
7994,23737,Neko Pitcher,,"Comedy, Sports, Kids"
7995,23753,Kishin Houkou Demonbane (TV) Specials,,"Magic, Mecha, Sci-Fi, Supernatural"
7996,23755,Nanatsu no Taizai,The Seven Deadly Sins,"Action, Adventure, Supernatural, Magic, Ecchi, Fantasy, Shounen"
7997,23759,Oira no Ski,My Ski Trip,"Comedy, Sports"
7998,23761,Konna ni Yasashiku Sareta no,,Hentai
7999,23775,Shingeki no Kyojin Movie 1: Guren no Yumiya,Attack on Titan: Crimson Bow and Arrow,"Action, Drama, Fantasy, Shounen, Super Power"
8000,23777,Shingeki no Kyojin Movie 2: Jiyuu no Tsubasa,Attack on Titan: Wings of Freedom,"Action, Super Power, Drama, Fantasy, Shounen"
8001,23781,Blade & Soul Specials,,Comedy
8002,23787,Hi☆sCoool! SeHa Girls,Hi☆sCoool! SeHa Girls,"Comedy, Game"
8003,23825,Ys IV: The Dawn of Ys,,"Action, Adventure, Fantasy, Game"
8004,23831,Mahou Shoujo Madoka★Magica Movie 3: Hangyaku no Monogatari - Magica Quartet x Nisioisin,,Comedy
8005,23835,Moonrakers,,"Drama, Sci-Fi, Space"
8006,23837,Meisou! Underworld,,"Action, Supernatural, Thriller"
8007,23847,Yahari Ore no Seishun Love Comedy wa Machigatteiru. Zoku,My Teen Romantic Comedy SNAFU TOO!,"Slice of Life, Comedy, Drama, Romance, School"
8008,23849,Pokemon XY: Sora no Hahen,,"Adventure, Fantasy, Kids"
8009,23871,Puchimas!!: Petit Petit iDOLM@STER - Fuyu→Kotatsu←Haru,,"Comedy, Music, Slice of Life"
8010,23877,Gondora,,Dementia
8011,23895,REACH x Thermae Romae: Pietrada no Kekkon,,"Comedy, Historical, Seinen"
8012,23897,Lovely Movie: Itoshi no Muco,Lovely Movie: Lovely Muuuuuuuco!,Slice of Life
8013,23901,Lovely Movie: Itoshi no Muco Season 2,Lovely Movie: Lovely Muuuuuuuco! Season 2,Slice of Life
8014,23903,Tuzki: Love Assassin,,"Comedy, Romance"
8015,23917,Sora wa Koko ni Aru,,Music
8016,23931,Uchuu Senkan Yamato 2199: Tsuioku no Koukai,,"Action, Military, Sci-Fi, Space, Drama"
8017,23933,Kyutai Panic Adventure!,,"Action, Martial Arts, Shounen, Super Power"
8018,23935,Kyutai Panic Adventure Returns!,,"Action, Shounen, Super Power"
8019,23943,Mobile Suit Gundam Unicorn: One of Seventy Two,,Mecha
8020,23945,Majimoji Rurumo,Magimoji Rurumo,"Comedy, Magic, Ecchi, Fantasy, School, Shounen"
8021,23985,Futari Ecchi (2014),,"Comedy, Ecchi, Romance, Seinen, Slice of Life"
8022,23987,Sarusuberi: Miss Hokusai,,"Historical, Supernatural, Drama, Seinen"
8023,23989,Maken-Ki! Two Specials,,Ecchi
8024,23991,Cardfight!! Vanguard Movie: Neon Messiah,,"Action, Adventure, Game, Demons, Shounen"
8025,24011,Lance N&#039; Masques,Lance N&#039; Masques,Fantasy
8026,24021,Sei Shoujo The Animation,,Hentai
8027,24023,Project758,,Drama
8028,24029,Shijou Saikyou no Deshi Kenichi Specials,,"Action, Martial Arts, Comedy, School, Shounen"
8029,24031,Denki-gai no Honya-san,Denki-gai,"Comedy, Seinen, Slice of Life"
8030,24037,Selector Spread WIXOSS,selector spread WIXOSS,"Game, Psychological"
8031,24071,gdgd Fairies Movie: tte Iu Eiga wa Dou kana...?,,"Comedy, Fantasy"
8032,24073,Konna Watashitachi ga Nariyuki de Heroine ni Natta Kekka www,,"Fantasy, Comedy"
8033,24075,Persona 4 the Golden Animation,Persona 4 the Golden ANIMATION,"Sci-Fi, Adventure, Mystery, Super Power, Supernatural, School"
8034,24109,Tooryanse,,"Supernatural, Music"
8035,24123,Kaette Kita Top wo Nerae! Kagaku Kouza,,"Comedy, Mecha, Sci-Fi"
8036,24127,Hashi no Mukou,,"Historical, Horror, Supernatural"
8037,24133,Taimadou Gakuen 35 Shiken Shoutai,AntiMagic Academy 35th Test Platoon,"Action, Ecchi, Fantasy, Harem, Military, Romance, Supernatural"
8038,24135,Nobunaga Concerto,,"Comedy, Historical, Romance, Shounen"
8039,24139,Tokyo Babylon: Vision,,"Music, Supernatural"
8040,24151,Ao Haru Ride OVA,,"Slice of Life, Romance, School, Shoujo"
8041,24169,Detective Conan: The Fugitive Kogorou Mouri,,"Mystery, Comedy"
8042,24171,Mushibugyou OVA,,"Action, Historical, Super Power, Ecchi, Martial Arts, Samurai, Fantasy, Shounen"
8043,24175,Nozo x Kimi,,"Comedy, Ecchi, Romance, School, Shounen"
8044,24179,Strobe Light,,Music
8045,24181,3-Nen C-Gumi 14-Ban Kubozono Chiyoko no Nyuukaku,,"Music, School"
8046,24197,E no Umakatta Tomodachi,,Music
8047,24199,Oosouji,,Music
8048,24201,Rakugaki Picasso,,Music
8049,24211,Orenchi no Furo Jijou,,"Comedy, Fantasy, Shoujo"
8050,24227,Nisekoi OVA,,"Comedy, Harem, Romance, School, Shounen"
8051,24231,Hitsugi no Chaika: Avenging Battle,Chaika -The Coffin Princess- Avenging Battle,"Action, Adventure, Comedy, Romance, Fantasy"
8052,24261,Hitsugi no Chaika OVA,,"Action, Adventure, Comedy, Fantasy"
8053,24271,Paizuri Cheerleader vs. Sakunyuu Ouendan!,,Hentai
8054,24273,Iinari! Saimin Kanojo,,Hentai
8055,24275,Medamayaki no Kimi Itsu Tsubusu?,,"Comedy, Seinen"
8056,24277,Yowamushi Pedal: Grande Road,,"Comedy, Drama, Shounen, Sports"
8057,24317,Love Colon,,Hentai
8058,24321,Hoka Hoka Oden no Uta,,Music
8059,24327,Oyome-sama Honey Days♥,,Hentai
8060,24347,Inazuma Eleven: Chou Jigen Dream Match,,"Sports, Super Power, Shounen"
8061,24357,Mokkai Shiyo?,,Hentai
8062,24365,Tonari no Seki-kun Specials,,"Comedy, School, Seinen"
8063,24371,Mobile Suit Gundam Unicorn: Episode EX - 100 Years of Solitude,,"Drama, Mecha, Military"
8064,24377,Spocon!,,Hentai
8065,24403,Nyanpuku Nyaruma,,Comedy
8066,24405,World Trigger,,"Action, Sci-Fi, Supernatural, School, Shounen"
8067,24415,Kuroko no Basket 3rd Season,Kuroko&#039;s Basketball 3,"Comedy, Sports, School, Shounen"
8068,24417,Maido! Urayasu Tekkin Kazoku,,"Comedy, Shounen"
8069,24429,Daze,,Music
8070,24437,World Fool News,,"Comedy, Slice of Life"
8071,24439,Kekkai Sensen,Blood Blockade Battlefront,"Action, Comedy, Super Power, Supernatural, Vampire, Fantasy, Shounen"
8072,24443,Peeping Life: Shinkon-chan Kansai ni Irasshai,"Peeping Life: Welcome to Kansai, Newlyweds!","Comedy, Slice of Life"
8073,24451,Kanojo ga Flag wo Oraretara OVA,,"Comedy, Harem, Romance, School"
8074,24453,Fetikano!,,Hentai
8075,24455,Madan no Ou to Vanadis,Lord Marksman and Vanadis,"Adventure, Ecchi, Fantasy, Harem, Romance"
8076,24457,Houkago no Ouji-sama,,"Comedy, School, Shounen, Sports"
8077,24459,Tales of Zestiria: Doushi no Yoake,Tales of Zestiria: Dawn of the Shepherd,Fantasy
8078,24469,Buddy Complex: Kanketsu-hen - Ano Sora ni Kaeru Mirai de,,"Action, Mecha, Sci-Fi"
8079,24471,Hoozuki no Reitetsu OVA,,"Comedy, Demons, Fantasy, Supernatural"
8080,24475,Mangaka-san to Assistant-san to The Animation Specials,,"Comedy, Ecchi, Harem, Seinen, Slice of Life"
8081,24527,Yomigaeru Sora Pilot,,"Action, Military, Seinen"
8082,24531,Ane Log: Moyako Neesan no Tomaranai Monologue,,"Comedy, Ecchi, School, Shounen"
8083,24543,Persona 3 the Movie 3: Falling Down,,"Action, Supernatural, Fantasy"
8084,24591,Youkai Watch Movie 1: Tanjou no Himitsu da Nyan!,"Yo-kai Watch the Movie: It&#039;s the Secret of Birth, Meow!","Comedy, Kids, Supernatural"
8085,24625,Gundam Build Fighters Try,Gundam Build Fighters Try,"Action, Sci-Fi, Mecha"
8086,24627,Yamada-kun to 7-nin no Majo (OVA),,"Comedy, Romance, School, Shounen"
8087,24629,Koufuku Graffiti,Gourmet Girl Graffiti,"Slice of Life, Comedy, Seinen"
8088,24633,LolitA☆Strawberry in Summer,,Music
8089,24637,G-On Riders Special,,"Sci-Fi, Comedy, Ecchi"
8090,24641,Baku Ane: Otouto Shibocchau zo! The Animation,,Hentai
8091,24655,Date A Live Movie: Mayuri Judgment,,"Harem, Romance, Sci-Fi"
8092,24675,Future Card Buddyfight Recap,,Game
8093,24687,Mushishi Zoku Shou: Odoro no Michi,Mushishi Path of Thorns,"Adventure, Slice of Life, Mystery, Historical, Supernatural, Fantasy, Seinen"
8094,24695,Gokukoku no Brynhildr Special,Brynhildr in the Darkness Special,"Comedy, Ecchi, Harem, Sci-Fi, Seinen"
8095,24699,Ai Tenchi Muyou!,,"Comedy, Sci-Fi, Shounen"
8096,24701,Mushishi Zoku Shou 2nd Season,,"Adventure, Fantasy, Historical, Mystery, Seinen, Slice of Life, Supernatural"
8097,24703,High School DxD BorN,High School DxD BorN,"Action, Comedy, Demons, Ecchi, Harem, Romance, School"
8098,24705,"Ore, Twintail ni Narimasu.",Gonna be the Twin-Tail!!,"Action, Comedy, Romance, Fantasy, School, Shounen"
8099,24713,Miss Monochrome: The Animation - Soccer-hen,,"Slice of Life, Comedy, Sports"
8100,24719,Shinrabanshou: Tenchi Shinmei no Shou,,"Action, Fantasy, Shounen"
8101,24727,Baka to Test to Shoukanjuu Ni!: Mahou Hideyoshi Hideyoshi,Baka and Test - Summon the Beasts: Magical Hideyoshi Hideyoshi,"Comedy, Magic"
8102,24743,Yakin Byoutou Specials,,Hentai
8103,24745,Yobai Suru Shichinin no Harame,,"Harem, Hentai"
8104,24751,Akuma no Riddle: Shousha wa Dare? Nukiuchi Test,,"Action, Ecchi, Comedy, Shoujo Ai"
8105,24763,Robot Girls Z Specials,,"Comedy, Mecha, Parody"
8106,24765,Gakkougurashi!,School-Live!,"Slice of Life, Psychological, School, Horror, Mystery"
8107,24781,Imawa no Kuni no Alice (OVA),,"Action, Psychological, Supernatural, Thriller, Shounen"
8108,24783,3-D Heaven,,"Music, Kids"
8109,24789,Shoko Nakagawa Prism Tour Special,,Music
8110,24793,Bloody Bunny,,Comedy
8111,24817,Fantasista Stella,,"Sports, Shounen"
8112,24821,Isshuukan Friends. Specials,,"Slice of Life, School"
8113,24823,Days,,Music
8114,24833,Ansatsu Kyoushitsu,Assassination Classroom,"Action, Comedy, School, Shounen"
8115,24835,Mobile Suit Gundam-san,,"Comedy, Parody, Mecha"
8116,24847,Ichigeki Sacchuu!! Hoihoi-san: Legacy,,"Comedy, Sci-Fi"
8117,24849,Injutsu no Yakata The Animation,,Hentai
8118,24851,Madonna: Kanjuku Body Collection,,"Harem, Hentai"
8119,24855,Girlfriend (Kari),Girl Friend Beta,"School, Slice of Life"
8120,24861,Akaoni to Aooni no Tango,,"Music, Kids"
8121,24873,Juuou Mujin no Fafnir,,"Fantasy, Harem, Romance, School"
8122,24893,Sidonia no Kishi: Daikyuu Wakusei Seneki,Knights of Sidonia: Battle for Planet Nine,"Action, Sci-Fi, Space, Mecha, Seinen"
8123,24909,Kaitou Joker,JOKER,"Adventure, Comedy, Mystery, Shounen"
8124,24911,Kyonyuu Try!: Tanki Shuuchuu Chichi Momi Lesson,,Hentai
8125,24913,Bokura wa Minna Kawai-sou: Hajimete no,,"Slice of Life, Comedy, Romance, School"
8126,24919,Aoki Hagane no Arpeggio: Ars Nova DC,,"Action, Sci-Fi, Seinen"
8127,24921,Aoki Hagane no Arpeggio: Ars Nova Cadenza,,"Action, Sci-Fi, Seinen"
8128,24935,Recorder to Randoseru Mi☆ Special,,"Slice of Life, Comedy, School, Seinen"
8129,24967,Ane Kyun!: Joshi ga Ie ni Kita!,,Hentai
8130,24973,Bokura wa Minna Kawai-sou Specials,,"Comedy, Seinen"
8131,24975,Ghibli ga Ippai Special Short Short,,Slice of Life
8132,24987,Furueru Kuchibiru Episode 0,,Hentai
8133,24991,No Game No Life Specials,,"Ecchi, Fantasy, Game"
8134,24997,Love Live! The School Idol Movie,Love Live! The School Idol Movie,"Music, School, Slice of Life"
8135,25011,Fate/kaleid liner Prisma☆Illya 2wei! Specials,Fate/Kaleid Liner Prisma Illya 2Wei! Shorts,"Comedy, Ecchi, Fantasy, Magic"
8136,25013,Akatsuki no Yona,Yona of the Dawn,"Action, Adventure, Comedy, Fantasy, Romance, Shoujo"
8137,25015,Kyoukai no Kanata Movie 1: I&#039;ll Be Here - Kako-hen,Beyond the Boundary: I&#039;ll Be Here - Past,"Action, Supernatural, Fantasy"
8138,25045,Barakamon: Mijikamon,,Comedy
8139,25049,Sushi Ninja,,"Action, Comedy, Fantasy"
8140,25055,Furifure The Animation,,Hentai
8141,25077,Bakumatsu Rock: Mystery! Onsen Kaijiken ze yo!!,,"Music, Mystery"
8142,25087,Ie Naki Ko Remy Specials (2001),,"Adventure, Slice of Life, Drama"
8143,25099,"Ore ga Ojousama Gakkou ni ""Shomin Sample"" Toshite Gets♥Sareta Ken",Shomin Sample,"Comedy, Ecchi, Harem, Romance, School"
8144,25113,Majokko Shimai no Yoyo to Nene Movie Extra: Hatsukoi - Mikako Komatsu,,Music
8145,25117,Ryuugajou Nanana no Maizoukin (TV) Specials,,Comedy
8146,25143,"Kono Danshi, Sekika ni Nayandemasu.",,"Drama, School, Shounen Ai"
8147,25157,Trinity Seven,Trinity Seven,"Action, Harem, Comedy, Supernatural, Magic, Romance, Ecchi, Fantasy, School, Shounen"
8148,25159,Inou-Battle wa Nichijou-kei no Naka de,When Supernatural Battles Became Commonplace,"Slice of Life, Comedy, Supernatural, Romance, School"
8149,25161,One Piece 3D2Y: Ace no shi wo Koete! Luffy Nakama Tono Chikai,,"Adventure, Comedy, Fantasy, Shounen"
8150,25169,Tamayura: More Aggressive Picture Drama,,"Comedy, Drama"
8151,25183,Gangsta.,Gangsta.,"Action, Drama, Seinen"
8152,25241,Akame ga Kill! Theater,AkaKill! Theater,Comedy
8153,25253,Nekketsu Jinmen Inu: Life Is Movie,,"Parody, Comedy, Mystery"
8154,25257,Persona 4 the Animation: Mr. Experiment Shorts,,Comedy
8155,25259,Persona 4 the Animation: A Brief Lesson on Izanagi & Izanami,,School
8156,25265,Megumi to Taiyou: Kajuu Gummi Tweet Love Story,,"Romance, Slice of Life"
8157,25267,Megumi to Taiyou II: Kajuu Gummi Tweet Mystery - Kieta Sapphire Roman no Nazo,,Mystery
8158,25271,Shinano Mainichi Shinbun,,Slice of Life
8159,25283,Kuusen Madoushi Kouhosei no Kyoukan,Sky Wizards Academy,"Action, Drama, Fantasy, Magic, School"
8160,25285,Seireitsukai no Blade Dance Specials,,"Action, Supernatural, Ecchi, Fantasy, School"
8161,25291,Yomiuri Shimbun,,Historical
8162,25293,Futago no Mahoutsukai Lico to Gli,The Wizard of twins LICO & GLI,"Magic, Music"
8163,25303,Haikyuu!!: Lev Genzan!,,"Sports, Shounen"
8164,25313,Gintama&#039;: Futon ni Haitte kara Buki Nokoshi ni Kizuite Neru ni Nerenai Toki mo Aru,,"Action, Sci-Fi, Comedy, Historical, Parody, Samurai, Shounen"
8165,25341,Diamond no Ace OVA,,"Comedy, Sports, School, Shounen"
8166,25345,Rance 01: Hikari wo Motomete The Animation,,"Fantasy, Hentai, Magic"
8167,25365,Pokemon XY: Koukoku no Princess Diancie,"Diancie, Princess of the Diamond Domain","Comedy, Fantasy, Kids"
8168,25375,Moon Pride,,"Music, Supernatural, Magic, Romance"
8169,25383,Doraemon Movie 35: Nobita no Space Heroes,,"Comedy, Kids, Shounen, Space"
8170,25389,Dragon Ball Z Movie 15: Fukkatsu no F,Dragon Ball Z: Resurrection &#039;F&#039;,"Action, Adventure, Comedy, Fantasy, Martial Arts, Shounen, Super Power"
8171,25393,Master of Torque 2,,"Action, Sci-Fi"
8172,25397,Absolute Duo,Absolute Duo,"Action, Harem, Supernatural, Romance, Ecchi, School"
8173,25429,Isuca,Isuca,"Action, Comedy, Ecchi, Romance, School, Seinen, Supernatural"
8174,25431,Chain Chronicle: Short Animation,,"Action, Adventure, Magic, Fantasy, Shounen"
8175,25437,Brothers Conflict OVA,,"Harem, Romance, Shoujo"
8176,25439,Choboraunyopomi Gekijou Dai Ni Maku Ai Mai Mii: Mousou Catastrophe Special,,"Slice of Life, Comedy"
8177,25441,Shin Strange+ Special,,"Slice of Life, Comedy, Josei"
8178,25457,Avengers Confidential: Black Widow to Punisher,Marvel Avengers Confidential: Black Widow & Punisher,"Action, Sci-Fi, Seinen"
8179,25461,Tatamp,,Music
8180,25491,Megumi to Taiyou III: Kajuu Gummi Tweet Fantasy - Timeline World,,Fantasy
8181,25495,fake!fake!,,Music
8182,25517,Magic Kaito 1412,,"Adventure, Comedy, Romance, Shounen"
8183,25519,Yuuki Yuuna wa Yuusha de Aru,Yuki Yuna is a Hero,"Slice of Life, Psychological, Drama, Magic, Fantasy"
8184,25533,Many Mary,,Music
8185,25537,Fate/stay night Movie: Heaven&#039;s Feel - I. Presage Flower,Fate/stay night: Heaven&#039;s Feel - I. Presage Flower,"Action, Fantasy, Magic, Supernatural"
8186,25543,M3: Sono Kuroki Hagane Recap,,"Action, Mecha"
8187,25549,Psychedelic Afternoon,,Music
8188,25567,DRAMAtical Murder OVA: Data_xx_Transitory,,"Psychological, Drama, Sci-Fi, Shounen Ai"
8189,25591,Tokyo Juushouden: Fuuma Gogyou Denshou,,"Action, Adventure, Supernatural, Shounen"
8190,25635,Space☆Dandy Picture Drama,,"Space, Comedy, Sci-Fi"
8191,25639,Toilet no Kamisama,,Music
8192,25641,Monotonous Purgatory,,Music
8193,25647,Sabage-bu! Specials,,"Action, Military, Comedy, Shoujo"
8194,25649,Junjou Romantica 3,Junjo Romantica 3,"Comedy, Drama, Romance, Shounen Ai"
8195,25667,Boy Meets Harem The Animation,,"Harem, Hentai"
8196,25669,Niku Mesu R30: Nikuyoku ni Ochita Mesu-tachi The Animation,,Hentai
8197,25681,Kamisama Hajimemashita◎,Kamisama Kiss Season 2,"Comedy, Demons, Supernatural, Romance, Fantasy, Shoujo"
8198,25687,Digimon Adventure tri. 1: Saikai,Digimon Adventure tri. Reunion,"Action, Adventure, Comedy, Drama"
8199,25689,Hyakka Ryouran: Samurai After,,"Ecchi, Harem"
8200,25719,"Futsuu no Joshikousei ga [Locodol] Yattemita.: Nagarekawa, Annai Shitemita.",,"Slice of Life, Comedy, Seinen"
8201,25729,Tamayura: Sotsugyou Shashin Part 1 - Kizashi,,"Comedy, Drama, Slice of Life"
8202,25731,Cross Ange: Tenshi to Ryuu no Rondo,Cross Ange: Rondo of Angel and Dragon,"Action, Sci-Fi, Mecha"
8203,25749,Yatterman Specials,,"Adventure, Comedy, Parody"
8204,25755,Yowamushi Pedal: Re:RIDE,Yowapeda Re:RIDE,"Sports, Drama, Shounen"
8205,25777,Shingeki no Kyojin Season 2,Attack on Titan Season 2,"Action, Military, Mystery, Super Power, Drama, Fantasy, Shounen"
8206,25781,Shingeki no Kyojin: Kuinaki Sentaku,,"Action, Fantasy, Shoujo"
8207,25801,Shouwa Genroku Rakugo Shinjuu: Yotarou Hourou-hen,,"Drama, Josei"
8208,25805,Pokemon the Movie XY: Ring no Choumajin Hoopa,Pokemon the Movie: Hoopa and the Clash of Ages,"Adventure, Kids, Fantasy"
8209,25833,Zephyr,,"Music, Drama"
8210,25835,Shirobako,Shirobako,"Comedy, Drama"
8211,25839,Bonjour♪Koiaji Pâtisserie,Bonjour♪Sweet Love Patisserie,"Slice of Life, Comedy, Harem, Romance, Shoujo"
8212,25857,PriPara Movie: Mi~nna Atsumare! Prism☆Tours,,"Music, Shoujo"
8213,25859,Re-Kan!,RE-KAN!,"Comedy, Supernatural, School, Seinen"
8214,25861,Inugami-san to Nekoyama-san Special,,"Comedy, School, Shoujo Ai"
8215,25867,Rolling☆Girls,The Rolling Girls,"Action, Adventure, Slice of Life, Super Power"
8216,25873,Toukiden Kiwami,,"Action, Fantasy, Martial Arts"
8217,25875,"Wake Up, Girl Zoo!","Wake Up, Girls! ZOO",Comedy
8218,25877,Demonion: Gaiden,,Hentai
8219,25879,Working!!!,Wagnaria!!3,"Comedy, Romance, Slice of Life"
8220,25883,Taisei Kensetsu: Vietnam Noi Bai Kuukou,,Drama
8221,25889,Stitch!: Itazura Alien no Daibouken - Uchuu Ichi no Oniichan,Son of Sprout,"Adventure, Comedy, Kids, Sci-Fi"
8222,25891,Stitch to Suna no Wakusei,Stitch and the Planet of Sand,"Adventure, Comedy, Kids, Sci-Fi"
8223,25897,Love Live! School Idol Project: μ&#039;s →NEXT LoveLive! 2014 - Endless Parade Makuai Drama,,Comedy
8224,25907,Glass no Hana to Kowasu Sekai,Garakowa -Restore the World-,Sci-Fi
8225,25915,Sakura Capusule,,"Slice of Life, Kids"
8226,25923,Oppai Gakuen Marching Band-bu!,,Hentai
8227,25939,Mahou Shoujo Lyrical Nanoha ViVid,,"Action, Adventure, Magic"
8228,25943,Hacka Doll,Hacka Doll,Fantasy
8229,25965,Backkom 2,Bernard,"Comedy, Kids"
8230,25971,Angel (Special),,Dementia
8231,25973,I Love Picnic,,"Kids, Comedy"
8232,25975,I Love Sky,,"Kids, Comedy"
8233,25991,Bishoujo Mobage: Mobami-chan,,Fantasy
8234,25999,Minna Atsumare! Falcom Gakuen SC,,"Parody, Comedy, School, Seinen"
8235,26019,Rokujouma no Shinryakusha!?,,"Romance, Supernatural, Comedy, School"
8236,26023,Haiyore! Nyaruko-san F,,"Sci-Fi, Comedy, Parody, Romance"
8237,26053,Futari wa Precure: Splash☆Star Maji★Doki♥ Theater,,"Action, Comedy, Fantasy, Magic, Shoujo"
8238,26055,JoJo no Kimyou na Bouken: Stardust Crusaders 2nd Season,JoJo&#039;s Bizarre Adventure: Stardust Crusaders - Battle in Egypt,"Action, Adventure, Drama, Shounen, Supernatural"
8239,26057,Fate/kaleid liner Prisma☆Illya 2wei! OVA,,"Ecchi, Fantasy, Magic, Comedy"
8240,26059,Samurai Hormone The Animation,,Hentai
8241,26063,Kaibutsu Oujo (OVA) Specials,,"Adventure, Comedy, Supernatural, Horror, Shounen"
8242,26079,Donyatsu Specials,,"Comedy, Sci-Fi, Seinen"
